{
  "events": [
    {
      "id": "corrida-dos-bonecos-gigantes",
      "name": "Corrida dos Bonecos Gigantes",
      "date": "07/02/2026",
      "dateISO": "2026-02-07T09:00:00",
      "dayOfWeek": "sábado",
      "time": "09:00",
      "category": "previas",
      "types": [
        "indicamos",
        "tradicional"
      ],
      "city": "olinda",
      "location": "Mercado da Ribeira",
      "isFree": true,
      "url": "https://penocarnaval.com.br/programacao/corrida-dos-bonecos-gigantes/"
    },
    {
      "id": "sai-dessa-noia",
      "name": "Sai dessa Noia",
      "date": "07/02/2026",
      "dateISO": "2026-02-07T10:00:00",
      "dayOfWeek": "sábado",
      "time": "10:00",
      "category": "blocos",
      "types": [],
      "city": "recife",
      "location": "Em frente ao colégio Sagrada Família",
      "isFree": true,
      "url": "https://penocarnaval.com.br/programacao/sai-dessa-noia/"
    },
    {
      "id": "eu-me-vingo-de-tu-no-carnaval",
      "name": "Eu Me Vingo de Tu no Carnaval",
      "date": "07/02/2026",
      "dateISO": "2026-02-07T10:00:00",
      "dayOfWeek": "sábado",
      "time": "10:00",
      "category": "blocos",
      "types": [],
      "city": "recife",
      "location": "Rua Mamede Simões",
      "isFree": true,
      "url": "https://penocarnaval.com.br/programacao/eu-me-vingo-de-tu-no-carnaval/"
    },
    {
      "id": "mangue-beatinho",
      "name": "Mangue beatinho",
      "date": "07/02/2026",
      "dateISO": "2026-02-07T10:00:00",
      "dayOfWeek": "sábado",
      "time": "10:00",
      "category": "blocos",
      "types": [
        "infantil"
      ],
      "city": "olinda",
      "location": "Praça do Carmo",
      "isFree": true,
      "url": "https://penocarnaval.com.br/programacao/mangue-beatinho/"
    },
    {
      "id": "cola-em-mim-que-e-sucesso",
      "name": "Cola Em Mim Que É Sucesso",
      "date": "07/02/2026",
      "dateISO": "2026-02-07T11:00:00",
      "dayOfWeek": "sábado",
      "time": "11:00",
      "category": "previas",
      "types": [],
      "city": "recife",
      "location": "Clube Náutico Capibaribe",
      "isFree": false,
      "url": "https://penocarnaval.com.br/programacao/cola-em-mim-que-e-sucesso/"
    },
    {
      "id": "turma-da-jaqueira-segurando-o-talo",
      "name": "Turma da Jaqueira segurando o talo",
      "date": "07/02/2026",
      "dateISO": "2026-02-07T11:00:00",
      "dayOfWeek": "sábado",
      "time": "11:00",
      "category": "blocos",
      "types": [],
      "city": "recife",
      "location": "Em frente ao Bar Rea",
      "isFree": true,
      "url": "https://penocarnaval.com.br/programacao/turma-da-jaqueira-segurando-o-talo/"
    },
    {
      "id": "quanta-lancheira",
      "name": "Quanta Lancheira",
      "date": "07/02/2026",
      "dateISO": "2026-02-07T11:00:00",
      "dayOfWeek": "sábado",
      "time": "11:00",
      "category": "blocos",
      "types": [
        "infantil"
      ],
      "city": "olinda",
      "location": "Centro de Cultura Luiz Freire",
      "isFree": false,
      "url": "https://penocarnaval.com.br/programacao/quanta-lancheira/"
    },
    {
      "id": "gardenal-da-tamarineira",
      "name": "Gardenal da tamarineira",
      "date": "07/02/2026",
      "dateISO": "2026-02-07T11:00:00",
      "dayOfWeek": "sábado",
      "time": "11:00",
      "category": "blocos",
      "types": [],
      "city": "recife",
      "location": "Rua Caio Pereira",
      "isFree": false,
      "url": "https://penocarnaval.com.br/programacao/gardenal-da-tamarineira/"
    },
    {
      "id": "acorda-pra-tomar-gagau",
      "name": "Acorda Pra Tomar Gagau",
      "date": "07/02/2026",
      "dateISO": "2026-02-07T12:00:00",
      "dayOfWeek": "sábado",
      "time": "12:00",
      "category": "blocos",
      "types": [],
      "city": "recife",
      "location": "Avenida Rio Branco",
      "isFree": true,
      "url": "https://penocarnaval.com.br/programacao/acorda-pra-tomar-gagau/"
    },
    {
      "id": "pega-vareta",
      "name": "Pega Vareta",
      "date": "07/02/2026",
      "dateISO": "2026-02-07T14:00:00",
      "dayOfWeek": "sábado",
      "time": "14:00",
      "category": "previas",
      "types": [],
      "city": "recife",
      "location": "Não definido",
      "isFree": false,
      "url": "https://penocarnaval.com.br/programacao/pega-vareta/"
    },
    {
      "id": "bloquinho-do-barcha-2",
      "name": "Bloquinho do Barcha",
      "date": "07/02/2026",
      "dateISO": "2026-02-07T14:00:00",
      "dayOfWeek": "sábado",
      "time": "14:00",
      "category": "blocos",
      "types": [],
      "city": "recife",
      "location": "Arena barcha",
      "isFree": false,
      "url": "https://penocarnaval.com.br/programacao/bloquinho-do-barcha-2/"
    },
    {
      "id": "bloco-num-pare-nao",
      "name": "Bloco Num Pare Não",
      "date": "07/02/2026",
      "dateISO": "2026-02-07T15:00:00",
      "dayOfWeek": "sábado",
      "time": "15:00",
      "category": "blocos",
      "types": [],
      "city": "recife",
      "location": "Catamaran Tours",
      "isFree": false,
      "url": "https://penocarnaval.com.br/programacao/bloco-num-pare-nao/"
    },
    {
      "id": "clube-vassourinha-de-olinda",
      "name": "clube vassourinha de Olinda",
      "date": "07/02/2026",
      "dateISO": "2026-02-07T15:00:00",
      "dayOfWeek": "sábado",
      "time": "15:00",
      "category": "previas",
      "types": [],
      "city": "recife",
      "location": "Cais da alfândega",
      "isFree": true,
      "url": "https://penocarnaval.com.br/programacao/clube-vassourinha-de-olinda/"
    },
    {
      "id": "o-gala",
      "name": "O Galã",
      "date": "07/02/2026",
      "dateISO": "2026-02-07T15:00:00",
      "dayOfWeek": "sábado",
      "time": "15:00",
      "category": "blocos",
      "types": [],
      "city": "olinda",
      "location": "Clube Atlântico Olindense",
      "isFree": false,
      "url": "https://penocarnaval.com.br/programacao/o-gala/"
    },
    {
      "id": "chocalho-do-neno",
      "name": "CHOCALHO DO NENO",
      "date": "07/02/2026",
      "dateISO": "2026-02-07T16:00:00",
      "dayOfWeek": "sábado",
      "time": "16:00",
      "category": "previas",
      "types": [],
      "city": "recife",
      "location": "Parador",
      "isFree": false,
      "url": "https://penocarnaval.com.br/programacao/chocalho-do-neno/"
    },
    {
      "id": "a-vaidosa",
      "name": "A Vaidosa",
      "date": "07/02/2026",
      "dateISO": "2026-02-07T16:00:00",
      "dayOfWeek": "sábado",
      "time": "16:00",
      "category": "previas",
      "types": [],
      "city": "olinda",
      "location": "Sede da Pitombeira dos Quatro Cantos",
      "isFree": true,
      "url": "https://penocarnaval.com.br/programacao/a-vaidosa/"
    },
    {
      "id": "caiu-na-rede-e-sereia",
      "name": "Caiu na rede é Sereia",
      "date": "07/02/2026",
      "dateISO": "2026-02-07T16:00:00",
      "dayOfWeek": "sábado",
      "time": "16:00",
      "category": "blocos",
      "types": [],
      "city": "olinda",
      "location": "Barrio",
      "isFree": true,
      "url": "https://penocarnaval.com.br/programacao/caiu-na-rede-e-sereia/"
    },
    {
      "id": "boizinho-da-macuca",
      "name": "Boizinho da Macuca",
      "date": "07/02/2026",
      "dateISO": "2026-02-07T16:00:00",
      "dayOfWeek": "sábado",
      "time": "16:00",
      "category": "blocos",
      "types": [
        "infantil"
      ],
      "city": "olinda",
      "location": "Praça do Carmo",
      "isFree": true,
      "url": "https://penocarnaval.com.br/programacao/boizinho-da-macuca/"
    },
    {
      "id": "ceroula-4",
      "name": "Ceroula",
      "date": "07/02/2026",
      "dateISO": "2026-02-07T16:00:00",
      "dayOfWeek": "sábado",
      "time": "16:00",
      "category": "previas",
      "types": [],
      "city": "recife",
      "location": "Cais da alfândega",
      "isFree": true,
      "url": "https://penocarnaval.com.br/programacao/ceroula-4/"
    },
    {
      "id": "a-pauta-que-nos-pariu",
      "name": "A PAUTA QUE NOS PARIU",
      "date": "07/02/2026",
      "dateISO": "2026-02-07T16:30:00",
      "dayOfWeek": "sábado",
      "time": "16:30",
      "category": "blocos",
      "types": [],
      "city": "olinda",
      "location": "Venda de Seu Biu",
      "isFree": false,
      "url": "https://penocarnaval.com.br/programacao/a-pauta-que-nos-pariu/"
    },
    {
      "id": "dasolinda",
      "name": "Dasolinda",
      "date": "07/02/2026",
      "dateISO": "2026-02-07T17:00:00",
      "dayOfWeek": "sábado",
      "time": "17:00",
      "category": "previas",
      "types": [],
      "city": "olinda",
      "location": "Mansão da Matuta",
      "isFree": false,
      "url": "https://penocarnaval.com.br/programacao/dasolinda/"
    },
    {
      "id": "batuques-de-pernambuco-2",
      "name": "Batuques de Pernambuco",
      "date": "07/02/2026",
      "dateISO": "2026-02-07T17:00:00",
      "dayOfWeek": "sábado",
      "time": "17:00",
      "category": "blocos",
      "types": [],
      "city": "olinda",
      "location": "Praça do Carmo",
      "isFree": true,
      "url": "https://penocarnaval.com.br/programacao/batuques-de-pernambuco-2/"
    },
    {
      "id": "baile-municipal-do-recife",
      "name": "60º Baile Municipal do Recife",
      "date": "07/02/2026",
      "dateISO": "2026-02-07T19:00:00",
      "dayOfWeek": "sábado",
      "time": "19:00",
      "category": "previas",
      "types": [
        "indicamos",
        "tradicional",
        "fantasia"
      ],
      "city": "recife",
      "location": "Classic Hall",
      "isFree": false,
      "url": "https://penocarnaval.com.br/programacao/baile-municipal-do-recife/"
    },
    {
      "id": "o-dono-do-mundo-previa",
      "name": "O dono do mundo",
      "date": "07/02/2026",
      "dateISO": "2026-02-07T21:00:00",
      "dayOfWeek": "sábado",
      "time": "21:00",
      "category": "previas",
      "types": [],
      "city": "olinda",
      "location": "Praça do Carmo",
      "isFree": true,
      "url": "https://penocarnaval.com.br/programacao/o-dono-do-mundo-previa/"
    },
    {
      "id": "olinda-beer",
      "name": "OLINDA BEER",
      "date": "08/02/2026",
      "dateISO": "2026-02-08T09:00:00",
      "dayOfWeek": "domingo",
      "time": "09:00",
      "category": "previas",
      "types": [
        "indicamos"
      ],
      "city": "olinda",
      "location": "Centro de Convenções de Pernambuco",
      "isFree": false,
      "url": "https://penocarnaval.com.br/programacao/olinda-beer/"
    },
    {
      "id": "9478",
      "name": "Bloco Ta Maluco",
      "date": "08/02/2026",
      "dateISO": "2026-02-08T10:00:00",
      "dayOfWeek": "domingo",
      "time": "10:00",
      "category": "blocos",
      "types": [
        "tradicional"
      ],
      "city": "olinda",
      "location": "Praça Coronel João Lapa",
      "isFree": true,
      "url": "https://penocarnaval.com.br/programacao/9478/"
    },
    {
      "id": "segundo-arrastao-sambadeiras",
      "name": "Arrastão Sambadeiras",
      "date": "08/02/2026",
      "dateISO": "2026-02-08T14:00:00",
      "dayOfWeek": "domingo",
      "time": "14:00",
      "category": "previas",
      "types": [
        "indicamos"
      ],
      "city": "olinda",
      "location": "Ladeira da Misericórdia",
      "isFree": true,
      "url": "https://penocarnaval.com.br/programacao/segundo-arrastao-sambadeiras/"
    },
    {
      "id": "cortejo-samba-soul-delas",
      "name": "Cortejo Samba Soul Delas",
      "date": "08/02/2026",
      "dateISO": "2026-02-08T14:00:00",
      "dayOfWeek": "domingo",
      "time": "14:00",
      "category": "previas",
      "types": [],
      "city": "olinda",
      "location": "Praça do Carmo",
      "isFree": true,
      "url": "https://penocarnaval.com.br/programacao/cortejo-samba-soul-delas/"
    },
    {
      "id": "quem-cola-entra-2",
      "name": "Quem cola entra",
      "date": "08/02/2026",
      "dateISO": "2026-02-08T14:00:00",
      "dayOfWeek": "domingo",
      "time": "14:00",
      "category": "previas",
      "types": [],
      "city": "olinda",
      "location": "Sede Cariri Olidense",
      "isFree": false,
      "url": "https://penocarnaval.com.br/programacao/quem-cola-entra-2/"
    },
    {
      "id": "arrastao-da-povoada",
      "name": "Arrastão da Povoada",
      "date": "08/02/2026",
      "dateISO": "2026-02-08T14:00:00",
      "dayOfWeek": "domingo",
      "time": "14:00",
      "category": "previas",
      "types": [],
      "city": "olinda",
      "location": "Praça do Rosário",
      "isFree": true,
      "url": "https://penocarnaval.com.br/programacao/arrastao-da-povoada/"
    },
    {
      "id": "fabrica-de-samba-arrastao",
      "name": "Fábrica de Samba – Ensaio",
      "date": "08/02/2026",
      "dateISO": "2026-02-08T15:00:00",
      "dayOfWeek": "domingo",
      "time": "15:00",
      "category": "previas",
      "types": [],
      "city": "olinda",
      "location": "Em Frente a Prefeitura de Olinda",
      "isFree": true,
      "url": "https://penocarnaval.com.br/programacao/fabrica-de-samba-arrastao/"
    },
    {
      "id": "bicho-maluco-beleza",
      "name": "Bicho Maluco Beleza",
      "date": "08/02/2026",
      "dateISO": "2026-02-08T15:00:00",
      "dayOfWeek": "domingo",
      "time": "15:00",
      "category": "blocos",
      "types": [
        "indicamos"
      ],
      "city": "recife",
      "location": "Rua da Aurora",
      "isFree": true,
      "url": "https://penocarnaval.com.br/programacao/bicho-maluco-beleza/"
    },
    {
      "id": "ensaios-casa-estao-da-luz-08-02",
      "name": "Ensaios – Casa Estação da Luz",
      "date": "08/02/2026",
      "dateISO": "2026-02-08T15:00:00",
      "dayOfWeek": "domingo",
      "time": "15:00",
      "category": "previas",
      "types": [
        "indicamos"
      ],
      "city": "olinda",
      "location": "Casa Estação da Luz",
      "isFree": false,
      "url": "https://penocarnaval.com.br/programacao/ensaios-casa-estao-da-luz-08-02/"
    },
    {
      "id": "mamaes-no-calcadao",
      "name": "Mamães no Calçadão",
      "date": "08/02/2026",
      "dateISO": "2026-02-08T15:00:00",
      "dayOfWeek": "domingo",
      "time": "15:00",
      "category": "blocos",
      "types": [
        "infantil"
      ],
      "city": "recife",
      "location": "Praça Marcantonio Vilaça",
      "isFree": false,
      "url": "https://penocarnaval.com.br/programacao/mamaes-no-calcadao/"
    },
    {
      "id": "cortejo-batadoni-2",
      "name": "Cortejo Batadoní",
      "date": "08/02/2026",
      "dateISO": "2026-02-08T16:00:00",
      "dayOfWeek": "domingo",
      "time": "16:00",
      "category": "previas",
      "types": [],
      "city": "olinda",
      "location": "Praça da Abolição",
      "isFree": true,
      "url": "https://penocarnaval.com.br/programacao/cortejo-batadoni-2/"
    },
    {
      "id": "bateria-tsunami-arrastao",
      "name": "Arrastão Bateria Tsunami",
      "date": "08/02/2026",
      "dateISO": "2026-02-08T16:00:00",
      "dayOfWeek": "domingo",
      "time": "16:00",
      "category": "previas",
      "types": [],
      "city": "olinda",
      "location": "Em frente a prefeitura de Olinda",
      "isFree": true,
      "url": "https://penocarnaval.com.br/programacao/bateria-tsunami-arrastao/"
    },
    {
      "id": "trote-vassourinha-de-olinda",
      "name": "Trote vassourinha de Olinda",
      "date": "08/02/2026",
      "dateISO": "2026-02-08T16:00:00",
      "dayOfWeek": "domingo",
      "time": "16:00",
      "category": "polos",
      "types": [],
      "city": "olinda",
      "location": "Largo do Guadalupe",
      "isFree": true,
      "url": "https://penocarnaval.com.br/programacao/trote-vassourinha-de-olinda/"
    },
    {
      "id": "linguarudo-do-bonsucesso",
      "name": "Linguarudo do Bonsucesso",
      "date": "08/02/2026",
      "dateISO": "2026-02-08T16:00:00",
      "dayOfWeek": "domingo",
      "time": "16:00",
      "category": "blocos",
      "types": [],
      "city": "olinda",
      "location": "Clube Vassourinhas de Olinda",
      "isFree": true,
      "url": "https://penocarnaval.com.br/programacao/linguarudo-do-bonsucesso/"
    },
    {
      "id": "pernambuco-meu-pais-4",
      "name": "Pernambuco meu país",
      "date": "08/02/2026",
      "dateISO": "2026-02-08T17:30:00",
      "dayOfWeek": "domingo",
      "time": "17:30",
      "category": "polos",
      "types": [
        "indicamos"
      ],
      "city": "recife",
      "location": "Terminal Marítimo Recife",
      "isFree": true,
      "url": "https://penocarnaval.com.br/programacao/pernambuco-meu-pais-4/"
    },
    {
      "id": "ceroula-3",
      "name": "Ceroula",
      "date": "08/02/2026",
      "dateISO": "2026-02-08T18:30:00",
      "dayOfWeek": "domingo",
      "time": "18:30",
      "category": "previas",
      "types": [],
      "city": "olinda",
      "location": "Cruzeiro de São Francisco",
      "isFree": true,
      "url": "https://penocarnaval.com.br/programacao/ceroula-3/"
    },
    {
      "id": "noite-para-os-tambores-silenciosos-de-olinda",
      "name": "NOITE PARA OS TAMBORES SILENCIOSOS DE OLINDA",
      "date": "09/02/2026",
      "dateISO": "2026-02-09T19:00:00",
      "dayOfWeek": "segunda-feira",
      "time": "19:00",
      "category": "previas",
      "types": [],
      "city": "olinda",
      "location": "Praça de São Pedro",
      "isFree": true,
      "url": "https://penocarnaval.com.br/programacao/noite-para-os-tambores-silenciosos-de-olinda/"
    },
    {
      "id": "bencao-do-mosteiro-olinda",
      "name": "Benção do Mosteiro – Olinda",
      "date": "10/02/2026",
      "dateISO": "2026-02-10T19:00:00",
      "dayOfWeek": "terça-feira",
      "time": "19:00",
      "category": "previas",
      "types": [],
      "city": "olinda",
      "location": "Ladeira do Varadouro",
      "isFree": true,
      "url": "https://penocarnaval.com.br/programacao/bencao-do-mosteiro-olinda/"
    },
    {
      "id": "quem-me-viu-quem-mv",
      "name": "Quem Me Viu, quem MV",
      "date": "11/02/2026",
      "dateISO": "2026-02-11T18:00:00",
      "dayOfWeek": "quarta-feira",
      "time": "18:00",
      "category": "blocos",
      "types": [],
      "city": "recife",
      "location": "Praça do Arsenal",
      "isFree": false,
      "url": "https://penocarnaval.com.br/programacao/quem-me-viu-quem-mv/"
    },
    {
      "id": "paraquedista-real",
      "name": "Paraquedista Real",
      "date": "11/02/2026",
      "dateISO": "2026-02-11T19:00:00",
      "dayOfWeek": "quarta-feira",
      "time": "19:00",
      "category": "blocos",
      "types": [],
      "city": "recife",
      "location": "Largo da Igreja do Poço da Panela",
      "isFree": true,
      "url": "https://penocarnaval.com.br/programacao/paraquedista-real/"
    },
    {
      "id": "bloco-garoto-da-noite",
      "name": "Bloco garoto da noite",
      "date": "12/02/2026",
      "dateISO": "2026-02-12T17:00:00",
      "dayOfWeek": "quinta-feira",
      "time": "17:00",
      "category": "blocos",
      "types": [],
      "city": "olinda",
      "location": "Rua de São Francisco n26, Carmo",
      "isFree": false,
      "url": "https://penocarnaval.com.br/programacao/bloco-garoto-da-noite/"
    },
    {
      "id": "carnaval-de-olinda-abertura",
      "name": "Carnaval de Olinda – Abertura",
      "date": "12/02/2026",
      "dateISO": "2026-02-12T18:00:00",
      "dayOfWeek": "quinta-feira",
      "time": "18:00",
      "category": "polos",
      "types": [
        "indicamos",
        "tradicional"
      ],
      "city": "olinda",
      "location": "Polo Erasto Vasconcelos",
      "isFree": true,
      "url": "https://penocarnaval.com.br/programacao/carnaval-de-olinda-abertura/"
    },
    {
      "id": "polo-marco-zero-quinta",
      "name": "MARCO ZERO",
      "date": "12/02/2026",
      "dateISO": "2026-02-12T18:00:00",
      "dayOfWeek": "quinta-feira",
      "time": "18:00",
      "category": "polos",
      "types": [
        "indicamos",
        "tradicional"
      ],
      "city": "recife",
      "location": "Marco Zero",
      "isFree": true,
      "url": "https://penocarnaval.com.br/programacao/polo-marco-zero-quinta/"
    },
    {
      "id": "me-mostra-teu-mapa-astral",
      "name": "Me Mostra Teu Mapa Astral",
      "date": "12/02/2026",
      "dateISO": "2026-02-12T18:00:00",
      "dayOfWeek": "quinta-feira",
      "time": "18:00",
      "category": "blocos",
      "types": [],
      "city": "recife",
      "location": "Praça Maciel Pinheiro",
      "isFree": true,
      "url": "https://penocarnaval.com.br/programacao/me-mostra-teu-mapa-astral/"
    },
    {
      "id": "festejo-encarnado",
      "name": "Festejo Encarnado",
      "date": "12/02/2026",
      "dateISO": "2026-02-12T18:00:00",
      "dayOfWeek": "quinta-feira",
      "time": "18:00",
      "category": "previas",
      "types": [],
      "city": "olinda",
      "location": "Largo do Guadalupe",
      "isFree": true,
      "url": "https://penocarnaval.com.br/programacao/festejo-encarnado/"
    },
    {
      "id": "chica-na-cama",
      "name": "Chica na cama",
      "date": "12/02/2026",
      "dateISO": "2026-02-12T19:00:00",
      "dayOfWeek": "quinta-feira",
      "time": "19:00",
      "category": "blocos",
      "types": [],
      "city": "recife",
      "location": "Chicama Recife",
      "isFree": false,
      "url": "https://penocarnaval.com.br/programacao/chica-na-cama/"
    },
    {
      "id": "escuta-levino",
      "name": "Escuta Levino",
      "date": "12/02/2026",
      "dateISO": "2026-02-12T20:00:00",
      "dayOfWeek": "quinta-feira",
      "time": "20:00",
      "category": "blocos",
      "types": [
        "tradicional"
      ],
      "city": "recife",
      "location": "Praça Maciel Pinheiro",
      "isFree": true,
      "url": "https://penocarnaval.com.br/programacao/escuta-levino/"
    },
    {
      "id": "seu-boteco-no-recife-antigo-quinta-feira",
      "name": "SEU BOTECO NO RECIFE ANTIGO",
      "date": "12/02/2026",
      "dateISO": "2026-02-12T20:00:00",
      "dayOfWeek": "quinta-feira",
      "time": "20:00",
      "category": "camarotes",
      "types": [],
      "city": "recife",
      "location": "Restaurante Seu Boteco",
      "isFree": false,
      "url": "https://penocarnaval.com.br/programacao/seu-boteco-no-recife-antigo-quinta-feira/"
    },
    {
      "id": "shortinho-torano",
      "name": "Shortinho Torano",
      "date": "12/02/2026",
      "dateISO": "2026-02-12T20:00:00",
      "dayOfWeek": "quinta-feira",
      "time": "20:00",
      "category": "blocos",
      "types": [],
      "city": "recife",
      "location": "Travessa do Bom Jesus",
      "isFree": true,
      "url": "https://penocarnaval.com.br/programacao/shortinho-torano/"
    },
    {
      "id": "bloco-do-ganso",
      "name": "Bloco do Ganso",
      "date": "13/02/2026",
      "dateISO": "2026-02-13T13:00:00",
      "dayOfWeek": "sexta-feira",
      "time": "13:00",
      "category": "blocos",
      "types": [],
      "city": "recife",
      "location": "EM FRENTE AO CAMPUS 2 DA UNIBRA",
      "isFree": false,
      "url": "https://penocarnaval.com.br/programacao/bloco-do-ganso/"
    },
    {
      "id": "segura-o-briefing",
      "name": "segura o briefing",
      "date": "13/02/2026",
      "dateISO": "2026-02-13T15:30:00",
      "dayOfWeek": "sexta-feira",
      "time": "15:30",
      "category": "blocos",
      "types": [],
      "city": "recife",
      "location": "Catamarã",
      "isFree": true,
      "url": "https://penocarnaval.com.br/programacao/segura-o-briefing/"
    },
    {
      "id": "nem-sempre-lily-toca-flauta",
      "name": "Nem Sempre Lily Toca Flauta",
      "date": "13/02/2026",
      "dateISO": "2026-02-13T16:00:00",
      "dayOfWeek": "sexta-feira",
      "time": "16:00",
      "category": "blocos",
      "types": [],
      "city": "recife",
      "location": "Pátio de Santa Cruz",
      "isFree": true,
      "url": "https://penocarnaval.com.br/programacao/nem-sempre-lily-toca-flauta/"
    },
    {
      "id": "segura-tu-2",
      "name": "Segura Tu",
      "date": "13/02/2026",
      "dateISO": "2026-02-13T16:30:00",
      "dayOfWeek": "sexta-feira",
      "time": "16:30",
      "category": "blocos",
      "types": [],
      "city": "recife",
      "location": "Praça de Casa Forte",
      "isFree": true,
      "url": "https://penocarnaval.com.br/programacao/segura-tu-2/"
    },
    {
      "id": "abduzidos-de-olinda-carnaval",
      "name": "Abduzidos de Olinda",
      "date": "13/02/2026",
      "dateISO": "2026-02-13T16:30:00",
      "dayOfWeek": "sexta-feira",
      "time": "16:30",
      "category": "blocos",
      "types": [
        "indicamos"
      ],
      "city": "olinda",
      "location": "Casa Nala",
      "isFree": true,
      "url": "https://penocarnaval.com.br/programacao/abduzidos-de-olinda-carnaval/"
    },
    {
      "id": "praca-do-arsenal-sexta",
      "name": "Praça do Arsenal",
      "date": "13/02/2026",
      "dateISO": "2026-02-13T17:00:00",
      "dayOfWeek": "sexta-feira",
      "time": "17:00",
      "category": "polos",
      "types": [
        "indicamos",
        "tradicional",
        "fantasia"
      ],
      "city": "recife",
      "location": "Praça do Arsenal",
      "isFree": true,
      "url": "https://penocarnaval.com.br/programacao/praca-do-arsenal-sexta/"
    },
    {
      "id": "caraca-moleque",
      "name": "Caraca Moleque",
      "date": "13/02/2026",
      "dateISO": "2026-02-13T17:00:00",
      "dayOfWeek": "sexta-feira",
      "time": "17:00",
      "category": "blocos",
      "types": [],
      "city": "olinda",
      "location": "Centro de Cultura Luiz Freire",
      "isFree": true,
      "url": "https://penocarnaval.com.br/programacao/caraca-moleque/"
    },
    {
      "id": "polo-marco-zero-sexta",
      "name": "MARCO ZERO",
      "date": "13/02/2026",
      "dateISO": "2026-02-13T18:00:00",
      "dayOfWeek": "sexta-feira",
      "time": "18:00",
      "category": "polos",
      "types": [
        "indicamos",
        "tradicional"
      ],
      "city": "recife",
      "location": "Marco Zero",
      "isFree": true,
      "url": "https://penocarnaval.com.br/programacao/polo-marco-zero-sexta/"
    },
    {
      "id": "sem-nome",
      "name": "Sem Nome",
      "date": "13/02/2026",
      "dateISO": "2026-02-13T18:00:00",
      "dayOfWeek": "sexta-feira",
      "time": "18:00",
      "category": "blocos",
      "types": [],
      "city": "olinda",
      "location": "Rua 27 de Janeiro, 197",
      "isFree": true,
      "url": "https://penocarnaval.com.br/programacao/sem-nome/"
    },
    {
      "id": "patio-de-sao-pedro-sexta",
      "name": "Pátio de São Pedro",
      "date": "13/02/2026",
      "dateISO": "2026-02-13T18:00:00",
      "dayOfWeek": "sexta-feira",
      "time": "18:00",
      "category": "polos",
      "types": [
        "indicamos",
        "tradicional",
        "fantasia"
      ],
      "city": "recife",
      "location": "Pátio de São Pedro",
      "isFree": true,
      "url": "https://penocarnaval.com.br/programacao/patio-de-sao-pedro-sexta/"
    },
    {
      "id": "olinda-frevo-folia",
      "name": "Olinda Frevo & Folia",
      "date": "13/02/2026",
      "dateISO": "2026-02-13T18:00:00",
      "dayOfWeek": "sexta-feira",
      "time": "18:00",
      "category": "blocos",
      "types": [],
      "city": "olinda",
      "location": "Clube Vassourinhas de Olinda",
      "isFree": false,
      "url": "https://penocarnaval.com.br/programacao/olinda-frevo-folia/"
    },
    {
      "id": "batuques-de-pernambuco",
      "name": "Batuques de Pernambuco",
      "date": "13/02/2026",
      "dateISO": "2026-02-13T18:00:00",
      "dayOfWeek": "sexta-feira",
      "time": "18:00",
      "category": "blocos",
      "types": [],
      "city": "recife",
      "location": "Rua da Moeda",
      "isFree": true,
      "url": "https://penocarnaval.com.br/programacao/batuques-de-pernambuco/"
    },
    {
      "id": "polo-gracas",
      "name": "Polo Graças",
      "date": "13/02/2026",
      "dateISO": "2026-02-13T18:00:00",
      "dayOfWeek": "sexta-feira",
      "time": "18:00",
      "category": "polos",
      "types": [],
      "city": "recife",
      "location": "",
      "isFree": true,
      "url": "https://penocarnaval.com.br/programacao/polo-gracas/"
    },
    {
      "id": "polo-do-samba",
      "name": "Polo do Samba",
      "date": "13/02/2026",
      "dateISO": "2026-02-13T18:00:00",
      "dayOfWeek": "sexta-feira",
      "time": "18:00",
      "category": "polos",
      "types": [],
      "city": "recife",
      "location": "",
      "isFree": true,
      "url": "https://penocarnaval.com.br/programacao/polo-do-samba/"
    },
    {
      "id": "polo-erasto-vasconcelos-sexta",
      "name": "Erasto Vasconcelos",
      "date": "13/02/2026",
      "dateISO": "2026-02-13T19:00:00",
      "dayOfWeek": "sexta-feira",
      "time": "19:00",
      "category": "polos",
      "types": [
        "indicamos",
        "tradicional"
      ],
      "city": "olinda",
      "location": "Polo Erasto Vasconcelos",
      "isFree": true,
      "url": "https://penocarnaval.com.br/programacao/polo-erasto-vasconcelos-sexta/"
    },
    {
      "id": "traquinos-em-folia",
      "name": "Traquinos em Folia",
      "date": "13/02/2026",
      "dateISO": "2026-02-13T19:00:00",
      "dayOfWeek": "sexta-feira",
      "time": "19:00",
      "category": "blocos",
      "types": [],
      "city": "olinda",
      "location": "Sede da Pitombeira dos Quatro Cantos",
      "isFree": true,
      "url": "https://penocarnaval.com.br/programacao/traquinos-em-folia/"
    },
    {
      "id": "mulher-do-dia",
      "name": "Mulher do Dia",
      "date": "13/02/2026",
      "dateISO": "2026-02-13T19:00:00",
      "dayOfWeek": "sexta-feira",
      "time": "19:00",
      "category": "blocos",
      "types": [
        "indicamos"
      ],
      "city": "olinda",
      "location": "Clube Vassourinhas de Olinda",
      "isFree": true,
      "url": "https://penocarnaval.com.br/programacao/mulher-do-dia/"
    },
    {
      "id": "du-nada-a-gente-sai",
      "name": "Du Nada a Gente Sai",
      "date": "13/02/2026",
      "dateISO": "2026-02-13T19:00:00",
      "dayOfWeek": "sexta-feira",
      "time": "19:00",
      "category": "blocos",
      "types": [],
      "city": "olinda",
      "location": "Largo do Amparo",
      "isFree": true,
      "url": "https://penocarnaval.com.br/programacao/du-nada-a-gente-sai/"
    },
    {
      "id": "seu-boteco-no-recife-antigo-sexta-feira",
      "name": "SEU BOTECO NO RECIFE ANTIGO",
      "date": "13/02/2026",
      "dateISO": "2026-02-13T20:00:00",
      "dayOfWeek": "sexta-feira",
      "time": "20:00",
      "category": "camarotes",
      "types": [],
      "city": "recife",
      "location": "Restaurante Seu Boteco",
      "isFree": false,
      "url": "https://penocarnaval.com.br/programacao/seu-boteco-no-recife-antigo-sexta-feira/"
    },
    {
      "id": "me-solta-carai",
      "name": "Me Solta, Carai!",
      "date": "13/02/2026",
      "dateISO": "2026-02-13T20:00:00",
      "dayOfWeek": "sexta-feira",
      "time": "20:00",
      "category": "blocos",
      "types": [],
      "city": "olinda",
      "location": "Largo do Amparo",
      "isFree": true,
      "url": "https://penocarnaval.com.br/programacao/me-solta-carai/"
    },
    {
      "id": "arrastao-da-bateria-cabulosa-2",
      "name": "Arrastão da Bateria Cabulosa",
      "date": "13/02/2026",
      "dateISO": "2026-02-13T21:00:00",
      "dayOfWeek": "sexta-feira",
      "time": "21:00",
      "category": "previas",
      "types": [],
      "city": "olinda",
      "location": "Em frente a Prefeitura de Olinda",
      "isFree": true,
      "url": "https://penocarnaval.com.br/programacao/arrastao-da-bateria-cabulosa-2/"
    },
    {
      "id": "la-ursa-do-bonfim",
      "name": "La Ursa do Bonfim",
      "date": "13/02/2026",
      "dateISO": "2026-02-13T21:00:00",
      "dayOfWeek": "sexta-feira",
      "time": "21:00",
      "category": "blocos",
      "types": [],
      "city": "olinda",
      "location": "Sede Cariri Olidense",
      "isFree": true,
      "url": "https://penocarnaval.com.br/programacao/la-ursa-do-bonfim/"
    },
    {
      "id": "o-lord-de-olinda",
      "name": "O Lord de Olinda",
      "date": "13/02/2026",
      "dateISO": "2026-02-13T23:00:00",
      "dayOfWeek": "sexta-feira",
      "time": "23:00",
      "category": "blocos",
      "types": [],
      "city": "olinda",
      "location": "Largo do Guadalupe",
      "isFree": true,
      "url": "https://penocarnaval.com.br/programacao/o-lord-de-olinda/"
    },
    {
      "id": "galo-da-madrugada",
      "name": "Galo da Madrugada",
      "date": "14/02/2026",
      "dateISO": "2026-02-14T05:00:00",
      "dayOfWeek": "sábado",
      "time": "05:00",
      "category": "blocos",
      "types": [
        "indicamos",
        "tradicional",
        "galo",
        "fantasia"
      ],
      "city": "recife",
      "location": "Praça Sérgio Lorêto",
      "isFree": true,
      "url": "https://penocarnaval.com.br/programacao/galo-da-madrugada/"
    },
    {
      "id": "pinto-do-galo-da-madrugada",
      "name": "Pinto do Galo da Madrugada",
      "date": "14/02/2026",
      "dateISO": "2026-02-14T06:45:00",
      "dayOfWeek": "sábado",
      "time": "06:45",
      "category": "blocos",
      "types": [
        "tradicional",
        "infantil"
      ],
      "city": "recife",
      "location": "Praça do Marco Zero",
      "isFree": true,
      "url": "https://penocarnaval.com.br/programacao/pinto-do-galo-da-madrugada/"
    },
    {
      "id": "to-aqui-galo",
      "name": "TÔ AQUI GALO",
      "date": "14/02/2026",
      "dateISO": "2026-02-14T08:00:00",
      "dayOfWeek": "sábado",
      "time": "08:00",
      "category": "camarotes",
      "types": [
        "galo"
      ],
      "city": "recife",
      "location": "Desfile do Galo",
      "isFree": false,
      "url": "https://penocarnaval.com.br/programacao/to-aqui-galo/"
    },
    {
      "id": "bora-galo",
      "name": "BORA GALO",
      "date": "14/02/2026",
      "dateISO": "2026-02-14T08:00:00",
      "dayOfWeek": "sábado",
      "time": "08:00",
      "category": "camarotes",
      "types": [
        "galo"
      ],
      "city": "recife",
      "location": "Desfile do Galo",
      "isFree": false,
      "url": "https://penocarnaval.com.br/programacao/bora-galo/"
    },
    {
      "id": "boteco-do-galo",
      "name": "BOTECO DO GALO",
      "date": "14/02/2026",
      "dateISO": "2026-02-14T08:00:00",
      "dayOfWeek": "sábado",
      "time": "08:00",
      "category": "camarotes",
      "types": [
        "galo"
      ],
      "city": "recife",
      "location": "Desfile do Galo",
      "isFree": false,
      "url": "https://penocarnaval.com.br/programacao/boteco-do-galo/"
    },
    {
      "id": "galo-downtown",
      "name": "GALO DOWNTOWN",
      "date": "14/02/2026",
      "dateISO": "2026-02-14T08:00:00",
      "dayOfWeek": "sábado",
      "time": "08:00",
      "category": "camarotes",
      "types": [
        "galo"
      ],
      "city": "recife",
      "location": "Desfile do Galo",
      "isFree": false,
      "url": "https://penocarnaval.com.br/programacao/galo-downtown/"
    },
    {
      "id": "galo-open",
      "name": "GALO OPEN",
      "date": "14/02/2026",
      "dateISO": "2026-02-14T08:00:00",
      "dayOfWeek": "sábado",
      "time": "08:00",
      "category": "camarotes",
      "types": [
        "galo"
      ],
      "city": "recife",
      "location": "Desfile do Galo",
      "isFree": false,
      "url": "https://penocarnaval.com.br/programacao/galo-open/"
    },
    {
      "id": "galo-summer",
      "name": "GALO SUMMER",
      "date": "14/02/2026",
      "dateISO": "2026-02-14T08:00:00",
      "dayOfWeek": "sábado",
      "time": "08:00",
      "category": "camarotes",
      "types": [
        "galo"
      ],
      "city": "recife",
      "location": "Desfile do Galo",
      "isFree": false,
      "url": "https://penocarnaval.com.br/programacao/galo-summer/"
    },
    {
      "id": "9378",
      "name": "MAJESTIC",
      "date": "14/02/2026",
      "dateISO": "2026-02-14T08:00:00",
      "dayOfWeek": "sábado",
      "time": "08:00",
      "category": "camarotes",
      "types": [
        "galo"
      ],
      "city": "recife",
      "location": "Desfile do Galo",
      "isFree": false,
      "url": "https://penocarnaval.com.br/programacao/9378/"
    },
    {
      "id": "9379",
      "name": "PARTIU GALO",
      "date": "14/02/2026",
      "dateISO": "2026-02-14T08:00:00",
      "dayOfWeek": "sábado",
      "time": "08:00",
      "category": "camarotes",
      "types": [
        "galo"
      ],
      "city": "recife",
      "location": "Desfile do Galo",
      "isFree": false,
      "url": "https://penocarnaval.com.br/programacao/9379/"
    },
    {
      "id": "9381",
      "name": "SEU VISCONDE NO GALO",
      "date": "14/02/2026",
      "dateISO": "2026-02-14T08:00:00",
      "dayOfWeek": "sábado",
      "time": "08:00",
      "category": "camarotes",
      "types": [
        "galo"
      ],
      "city": "recife",
      "location": "Desfile do Galo",
      "isFree": false,
      "url": "https://penocarnaval.com.br/programacao/9381/"
    },
    {
      "id": "camarote-sr-chopp",
      "name": "SR CHOPP",
      "date": "14/02/2026",
      "dateISO": "2026-02-14T08:00:00",
      "dayOfWeek": "sábado",
      "time": "08:00",
      "category": "camarotes",
      "types": [
        "galo"
      ],
      "city": "recife",
      "location": "Desfile do Galo",
      "isFree": false,
      "url": "https://penocarnaval.com.br/programacao/camarote-sr-chopp/"
    },
    {
      "id": "9384",
      "name": "CAMAROTE DO ZEZO",
      "date": "14/02/2026",
      "dateISO": "2026-02-14T08:00:00",
      "dayOfWeek": "sábado",
      "time": "08:00",
      "category": "camarotes",
      "types": [
        "galo"
      ],
      "city": "recife",
      "location": "Desfile do Galo",
      "isFree": false,
      "url": "https://penocarnaval.com.br/programacao/9384/"
    },
    {
      "id": "seu-antonio-no-galo",
      "name": "SEU ANTÔNIO NO GALO",
      "date": "14/02/2026",
      "dateISO": "2026-02-14T08:00:00",
      "dayOfWeek": "sábado",
      "time": "08:00",
      "category": "camarotes",
      "types": [
        "galo"
      ],
      "city": "recife",
      "location": "Desfile do Galo",
      "isFree": false,
      "url": "https://penocarnaval.com.br/programacao/seu-antonio-no-galo/"
    },
    {
      "id": "trinca-de-as",
      "name": "Trinca de Ás",
      "date": "14/02/2026",
      "dateISO": "2026-02-14T08:00:00",
      "dayOfWeek": "sábado",
      "time": "08:00",
      "category": "blocos",
      "types": [
        "indicamos",
        "tradicional"
      ],
      "city": "olinda",
      "location": "Ladeira da Prefeitura",
      "isFree": true,
      "url": "https://penocarnaval.com.br/programacao/trinca-de-as/"
    },
    {
      "id": "bloco-galinha-dagua",
      "name": "Galinha d’Água",
      "date": "14/02/2026",
      "dateISO": "2026-02-14T08:00:00",
      "dayOfWeek": "sábado",
      "time": "08:00",
      "category": "blocos",
      "types": [],
      "city": "recife",
      "location": "Rio Capibaribe",
      "isFree": true,
      "url": "https://penocarnaval.com.br/programacao/bloco-galinha-dagua/"
    },
    {
      "id": "o-urso-cascudo-do-amparo",
      "name": "O Urso Cascudo do Amparo",
      "date": "14/02/2026",
      "dateISO": "2026-02-14T08:00:00",
      "dayOfWeek": "sábado",
      "time": "08:00",
      "category": "blocos",
      "types": [],
      "city": "olinda",
      "location": "Largo do Guadalupe",
      "isFree": true,
      "url": "https://penocarnaval.com.br/programacao/o-urso-cascudo-do-amparo/"
    },
    {
      "id": "sibito-baleado",
      "name": "Sibito Baleado",
      "date": "14/02/2026",
      "dateISO": "2026-02-14T08:00:00",
      "dayOfWeek": "sábado",
      "time": "08:00",
      "category": "blocos",
      "types": [],
      "city": "olinda",
      "location": "Rua Coronel Joaquim Cavalcanti, 201",
      "isFree": false,
      "url": "https://penocarnaval.com.br/programacao/sibito-baleado/"
    },
    {
      "id": "10408",
      "name": "Se você não for eu vou",
      "date": "14/02/2026",
      "dateISO": "2026-02-14T08:30:00",
      "dayOfWeek": "sábado",
      "time": "08:30",
      "category": "camarotes",
      "types": [],
      "city": "recife",
      "location": "Desfile do Galo",
      "isFree": false,
      "url": "https://penocarnaval.com.br/programacao/10408/"
    },
    {
      "id": "juntas-e-misturadas-no-galo",
      "name": "JUNTAS E MISTURADAS NO GALO",
      "date": "14/02/2026",
      "dateISO": "2026-02-14T09:00:00",
      "dayOfWeek": "sábado",
      "time": "09:00",
      "category": "camarotes",
      "types": [
        "galo"
      ],
      "city": "recife",
      "location": "Desfile do Galo",
      "isFree": false,
      "url": "https://penocarnaval.com.br/programacao/juntas-e-misturadas-no-galo/"
    },
    {
      "id": "nosso-galo",
      "name": "NOSSO GALO",
      "date": "14/02/2026",
      "dateISO": "2026-02-14T09:00:00",
      "dayOfWeek": "sábado",
      "time": "09:00",
      "category": "camarotes",
      "types": [
        "galo"
      ],
      "city": "recife",
      "location": "Desfile do Galo",
      "isFree": false,
      "url": "https://penocarnaval.com.br/programacao/nosso-galo/"
    },
    {
      "id": "camarote-galo-privilege",
      "name": "GALO PRIVILEGE",
      "date": "14/02/2026",
      "dateISO": "2026-02-14T09:00:00",
      "dayOfWeek": "sábado",
      "time": "09:00",
      "category": "camarotes",
      "types": [
        "galo"
      ],
      "city": "recife",
      "location": "Rua Imperial",
      "isFree": false,
      "url": "https://penocarnaval.com.br/programacao/camarote-galo-privilege/"
    },
    {
      "id": "terraco-do-galo",
      "name": "TERRAÇO DO GALO",
      "date": "14/02/2026",
      "dateISO": "2026-02-14T09:00:00",
      "dayOfWeek": "sábado",
      "time": "09:00",
      "category": "camarotes",
      "types": [
        "galo"
      ],
      "city": "recife",
      "location": "Rua Imperial, 84",
      "isFree": false,
      "url": "https://penocarnaval.com.br/programacao/terraco-do-galo/"
    },
    {
      "id": "balanca-rolha",
      "name": "BALANÇA ROLHA",
      "date": "14/02/2026",
      "dateISO": "2026-02-14T09:00:00",
      "dayOfWeek": "sábado",
      "time": "09:00",
      "category": "camarotes",
      "types": [
        "galo"
      ],
      "city": "recife",
      "location": "Av. Sul e Rua Imperial, embaixo do viaduto Capitão Temudo",
      "isFree": false,
      "url": "https://penocarnaval.com.br/programacao/balanca-rolha/"
    },
    {
      "id": "eu-acho-e-pouco",
      "name": "Eu acho é pouco",
      "date": "14/02/2026",
      "dateISO": "2026-02-14T09:00:00",
      "dayOfWeek": "sábado",
      "time": "09:00",
      "category": "blocos",
      "types": [
        "indicamos",
        "tradicional",
        "fantasia"
      ],
      "city": "olinda",
      "location": "Praça Laura Nigro",
      "isFree": true,
      "url": "https://penocarnaval.com.br/programacao/eu-acho-e-pouco/"
    },
    {
      "id": "bloco-mangue-beat",
      "name": "Mangue Beat",
      "date": "14/02/2026",
      "dateISO": "2026-02-14T09:00:00",
      "dayOfWeek": "sábado",
      "time": "09:00",
      "category": "blocos",
      "types": [
        "indicamos"
      ],
      "city": "olinda",
      "location": "Pátio de São Bento",
      "isFree": true,
      "url": "https://penocarnaval.com.br/programacao/bloco-mangue-beat/"
    },
    {
      "id": "casa-pe-no-carnaval",
      "name": "Casa PE no Carnaval",
      "date": "14/02/2026",
      "dateISO": "2026-02-14T09:00:00",
      "dayOfWeek": "sábado",
      "time": "09:00",
      "category": "day-use",
      "types": [
        "indicamos"
      ],
      "city": "olinda",
      "location": "Rua São Bento, 200",
      "isFree": false,
      "url": "https://penocarnaval.com.br/programacao/casa-pe-no-carnaval/"
    },
    {
      "id": "tambores-dsaia-sabado",
      "name": "Tambores D’Saia",
      "date": "14/02/2026",
      "dateISO": "2026-02-14T09:00:00",
      "dayOfWeek": "sábado",
      "time": "09:00",
      "category": "blocos",
      "types": [],
      "city": "olinda",
      "location": "Praça de São Pedro",
      "isFree": true,
      "url": "https://penocarnaval.com.br/programacao/tambores-dsaia-sabado/"
    },
    {
      "id": "patusquinho",
      "name": "Patusquinho",
      "date": "14/02/2026",
      "dateISO": "2026-02-14T09:00:00",
      "dayOfWeek": "sábado",
      "time": "09:00",
      "category": "blocos",
      "types": [
        "fantasia",
        "infantil"
      ],
      "city": "olinda",
      "location": "Pátio da Igreja de São Pedro",
      "isFree": true,
      "url": "https://penocarnaval.com.br/programacao/patusquinho/"
    },
    {
      "id": "soul-delas",
      "name": "Soul Delas",
      "date": "14/02/2026",
      "dateISO": "2026-02-14T09:00:00",
      "dayOfWeek": "sábado",
      "time": "09:00",
      "category": "blocos",
      "types": [],
      "city": "olinda",
      "location": "Mosteiro de São Bento",
      "isFree": true,
      "url": "https://penocarnaval.com.br/programacao/soul-delas/"
    },
    {
      "id": "bloco-do-frei",
      "name": "Bloco do Frei",
      "date": "14/02/2026",
      "dateISO": "2026-02-14T09:00:00",
      "dayOfWeek": "sábado",
      "time": "09:00",
      "category": "blocos",
      "types": [],
      "city": "olinda",
      "location": "Em frente ao Convento de São Francisco",
      "isFree": true,
      "url": "https://penocarnaval.com.br/programacao/bloco-do-frei/"
    },
    {
      "id": "maracatu-kangoma",
      "name": "Maracatu Kangoma",
      "date": "14/02/2026",
      "dateISO": "2026-02-14T09:00:00",
      "dayOfWeek": "sábado",
      "time": "09:00",
      "category": "blocos",
      "types": [],
      "city": "olinda",
      "location": "Rua do amparo, 236",
      "isFree": true,
      "url": "https://penocarnaval.com.br/programacao/maracatu-kangoma/"
    },
    {
      "id": "batucada-atmica-sabado-carnaval",
      "name": "Batucada Atômica",
      "date": "14/02/2026",
      "dateISO": "2026-02-14T09:00:00",
      "dayOfWeek": "sábado",
      "time": "09:00",
      "category": "blocos",
      "types": [],
      "city": "olinda",
      "location": "Avenida 10 de Novembro",
      "isFree": true,
      "url": "https://penocarnaval.com.br/programacao/batucada-atmica-sabado-carnaval/"
    },
    {
      "id": "casa-babylon-de-olinda-sabado",
      "name": "Casa Babylon de Olinda",
      "date": "14/02/2026",
      "dateISO": "2026-02-14T10:00:00",
      "dayOfWeek": "sábado",
      "time": "10:00",
      "category": "day-use",
      "types": [],
      "city": "olinda",
      "location": "Rua 27 de Janeiro, 7, Carmo",
      "isFree": false,
      "url": "https://penocarnaval.com.br/programacao/casa-babylon-de-olinda-sabado/"
    },
    {
      "id": "pife-floyd",
      "name": "Pife Floyd",
      "date": "14/02/2026",
      "dateISO": "2026-02-14T10:00:00",
      "dayOfWeek": "sábado",
      "time": "10:00",
      "category": "blocos",
      "types": [],
      "city": "olinda",
      "location": "Travessa de São Francisco, 206 , Carmo",
      "isFree": true,
      "url": "https://penocarnaval.com.br/programacao/pife-floyd/"
    },
    {
      "id": "estacao-da-luz-sabado",
      "name": "Estação da Luz",
      "date": "14/02/2026",
      "dateISO": "2026-02-14T10:00:00",
      "dayOfWeek": "sábado",
      "time": "10:00",
      "category": "day-use",
      "types": [],
      "city": "olinda",
      "location": "Casa Estação da Luz",
      "isFree": false,
      "url": "https://penocarnaval.com.br/programacao/estacao-da-luz-sabado/"
    },
    {
      "id": "urso-congelado",
      "name": "Urso Congelado",
      "date": "14/02/2026",
      "dateISO": "2026-02-14T10:00:00",
      "dayOfWeek": "sábado",
      "time": "10:00",
      "category": "blocos",
      "types": [],
      "city": "olinda",
      "location": "Praça do Carmo",
      "isFree": true,
      "url": "https://penocarnaval.com.br/programacao/urso-congelado/"
    },
    {
      "id": "fabrica-de-samba-sabado",
      "name": "Fábrica de Samba",
      "date": "14/02/2026",
      "dateISO": "2026-02-14T10:00:00",
      "dayOfWeek": "sábado",
      "time": "10:00",
      "category": "blocos",
      "types": [],
      "city": "olinda",
      "location": "Igreja de São Pedro",
      "isFree": true,
      "url": "https://penocarnaval.com.br/programacao/fabrica-de-samba-sabado/"
    },
    {
      "id": "ta-calor-nessa-roupa",
      "name": "Tá Calor Nessa Roupa?",
      "date": "14/02/2026",
      "dateISO": "2026-02-14T10:00:00",
      "dayOfWeek": "sábado",
      "time": "10:00",
      "category": "blocos",
      "types": [],
      "city": "olinda",
      "location": "Casbah",
      "isFree": true,
      "url": "https://penocarnaval.com.br/programacao/ta-calor-nessa-roupa/"
    },
    {
      "id": "fique-na-sombra",
      "name": "Fique na Sombra",
      "date": "14/02/2026",
      "dateISO": "2026-02-14T10:00:00",
      "dayOfWeek": "sábado",
      "time": "10:00",
      "category": "blocos",
      "types": [],
      "city": "olinda",
      "location": "Rua da Boa Hora, 177",
      "isFree": true,
      "url": "https://penocarnaval.com.br/programacao/fique-na-sombra/"
    },
    {
      "id": "moidicuento",
      "name": "Moidicuento",
      "date": "14/02/2026",
      "dateISO": "2026-02-14T10:00:00",
      "dayOfWeek": "sábado",
      "time": "10:00",
      "category": "blocos",
      "types": [],
      "city": "olinda",
      "location": "Estrada do Bonsucesso, 520",
      "isFree": false,
      "url": "https://penocarnaval.com.br/programacao/moidicuento/"
    },
    {
      "id": "sombatuki-2",
      "name": "Sombatuki",
      "date": "14/02/2026",
      "dateISO": "2026-02-14T10:00:00",
      "dayOfWeek": "sábado",
      "time": "10:00",
      "category": "blocos",
      "types": [],
      "city": "olinda",
      "location": "Largo do Amparo",
      "isFree": true,
      "url": "https://penocarnaval.com.br/programacao/sombatuki-2/"
    },
    {
      "id": "se-me-der-eu-como",
      "name": "Se me der eu como",
      "date": "14/02/2026",
      "dateISO": "2026-02-14T11:30:00",
      "dayOfWeek": "sábado",
      "time": "11:30",
      "category": "blocos",
      "types": [],
      "city": "olinda",
      "location": "Rua do Bonfim, 386",
      "isFree": true,
      "url": "https://penocarnaval.com.br/programacao/se-me-der-eu-como/"
    },
    {
      "id": "ceroula",
      "name": "Ceroula",
      "date": "14/02/2026",
      "dateISO": "2026-02-14T12:00:00",
      "dayOfWeek": "sábado",
      "time": "12:00",
      "category": "blocos",
      "types": [
        "indicamos",
        "tradicional"
      ],
      "city": "olinda",
      "location": "Colégio São Bento de Olinda",
      "isFree": true,
      "url": "https://penocarnaval.com.br/programacao/ceroula/"
    },
    {
      "id": "hoje-a-mangueira-entra",
      "name": "Hoje a Mangueira Entra",
      "date": "14/02/2026",
      "dateISO": "2026-02-14T12:00:00",
      "dayOfWeek": "sábado",
      "time": "12:00",
      "category": "blocos",
      "types": [
        "indicamos",
        "tradicional",
        "fantasia"
      ],
      "city": "olinda",
      "location": "Rua coronel Joaquim Cavalcante, 487 (varadouro)",
      "isFree": true,
      "url": "https://penocarnaval.com.br/programacao/hoje-a-mangueira-entra/"
    },
    {
      "id": "carvalheira-na-ladeira-domingo",
      "name": "CARVALHEIRA NA LADEIRA",
      "date": "14/02/2026",
      "dateISO": "2026-02-14T14:00:00",
      "dayOfWeek": "sábado",
      "time": "14:00",
      "category": "camarotes",
      "types": [
        "indicamos"
      ],
      "city": "olinda",
      "location": "Parque Memorial Arcoverde",
      "isFree": false,
      "url": "https://penocarnaval.com.br/programacao/carvalheira-na-ladeira-domingo/"
    },
    {
      "id": "carnaval-boa-viagem-sabado",
      "name": "Carnaval Boa Viagem",
      "date": "14/02/2026",
      "dateISO": "2026-02-14T14:00:00",
      "dayOfWeek": "sábado",
      "time": "14:00",
      "category": "camarotes",
      "types": [
        "indicamos"
      ],
      "city": "recife",
      "location": "Arena Boa Viagem",
      "isFree": false,
      "url": "https://penocarnaval.com.br/programacao/carnaval-boa-viagem-sabado/"
    },
    {
      "id": "sobrecu",
      "name": "Sobrecú",
      "date": "14/02/2026",
      "dateISO": "2026-02-14T14:00:00",
      "dayOfWeek": "sábado",
      "time": "14:00",
      "category": "blocos",
      "types": [],
      "city": "olinda",
      "location": "Beco do Bajado",
      "isFree": true,
      "url": "https://penocarnaval.com.br/programacao/sobrecu/"
    },
    {
      "id": "bumba-meu-bowie",
      "name": "Bumba meu Bowie",
      "date": "14/02/2026",
      "dateISO": "2026-02-14T14:00:00",
      "dayOfWeek": "sábado",
      "time": "14:00",
      "category": "blocos",
      "types": [],
      "city": "olinda",
      "location": "Praça do Jacaré",
      "isFree": true,
      "url": "https://penocarnaval.com.br/programacao/bumba-meu-bowie/"
    },
    {
      "id": "chapadinhos-na-praia",
      "name": "Chapadinhos na praia",
      "date": "14/02/2026",
      "dateISO": "2026-02-14T14:00:00",
      "dayOfWeek": "sábado",
      "time": "14:00",
      "category": "blocos",
      "types": [],
      "city": "olinda",
      "location": "Alto da Sé",
      "isFree": true,
      "url": "https://penocarnaval.com.br/programacao/chapadinhos-na-praia/"
    },
    {
      "id": "maracadonna",
      "name": "Maracadonna",
      "date": "14/02/2026",
      "dateISO": "2026-02-14T14:00:00",
      "dayOfWeek": "sábado",
      "time": "14:00",
      "category": "blocos",
      "types": [],
      "city": "olinda",
      "location": "Praça do Jacaré",
      "isFree": true,
      "url": "https://penocarnaval.com.br/programacao/maracadonna/"
    },
    {
      "id": "cordas-e-retalhos",
      "name": "Cordas e Retalhos",
      "date": "14/02/2026",
      "dateISO": "2026-02-14T15:00:00",
      "dayOfWeek": "sábado",
      "time": "15:00",
      "category": "blocos",
      "types": [],
      "city": "recife",
      "location": "Rua da Guia, 86",
      "isFree": true,
      "url": "https://penocarnaval.com.br/programacao/cordas-e-retalhos/"
    },
    {
      "id": "menino-da-tarde",
      "name": "Menino da Tarde",
      "date": "14/02/2026",
      "dateISO": "2026-02-14T16:00:00",
      "dayOfWeek": "sábado",
      "time": "16:00",
      "category": "blocos",
      "types": [
        "indicamos",
        "tradicional"
      ],
      "city": "olinda",
      "location": "Largo do Guadalupe",
      "isFree": true,
      "url": "https://penocarnaval.com.br/programacao/menino-da-tarde/"
    },
    {
      "id": "ta-bom-a-gente-freva",
      "name": "Tá Bom a Gente Freva",
      "date": "14/02/2026",
      "dateISO": "2026-02-14T16:00:00",
      "dayOfWeek": "sábado",
      "time": "16:00",
      "category": "blocos",
      "types": [],
      "city": "olinda",
      "location": "Mosteiro de São Bento",
      "isFree": true,
      "url": "https://penocarnaval.com.br/programacao/ta-bom-a-gente-freva/"
    },
    {
      "id": "afojuba-batuque",
      "name": "Afojubá Batuque",
      "date": "14/02/2026",
      "dateISO": "2026-02-14T16:00:00",
      "dayOfWeek": "sábado",
      "time": "16:00",
      "category": "blocos",
      "types": [],
      "city": "olinda",
      "location": "Mosteiro de São Bento",
      "isFree": true,
      "url": "https://penocarnaval.com.br/programacao/afojuba-batuque/"
    },
    {
      "id": "praca-do-arsenal-sabado",
      "name": "Praça do Arsenal",
      "date": "14/02/2026",
      "dateISO": "2026-02-14T17:00:00",
      "dayOfWeek": "sábado",
      "time": "17:00",
      "category": "polos",
      "types": [
        "indicamos",
        "tradicional",
        "fantasia"
      ],
      "city": "recife",
      "location": "Praça do Arsenal",
      "isFree": true,
      "url": "https://penocarnaval.com.br/programacao/praca-do-arsenal-sabado/"
    },
    {
      "id": "polo-guadalupe-sabado",
      "name": "Guadalupe",
      "date": "14/02/2026",
      "dateISO": "2026-02-14T17:00:00",
      "dayOfWeek": "sábado",
      "time": "17:00",
      "category": "polos",
      "types": [
        "indicamos",
        "tradicional"
      ],
      "city": "olinda",
      "location": "Guadalupe",
      "isFree": true,
      "url": "https://penocarnaval.com.br/programacao/polo-guadalupe-sabado/"
    },
    {
      "id": "papudinhos-do-bonsucesso",
      "name": "Papudinhos do bonsucesso",
      "date": "14/02/2026",
      "dateISO": "2026-02-14T17:00:00",
      "dayOfWeek": "sábado",
      "time": "17:00",
      "category": "blocos",
      "types": [],
      "city": "olinda",
      "location": "Espaço Cultural Osvaldo Sérgio",
      "isFree": true,
      "url": "https://penocarnaval.com.br/programacao/papudinhos-do-bonsucesso/"
    },
    {
      "id": "polo-marco-zero-sabado",
      "name": "MARCO ZERO",
      "date": "14/02/2026",
      "dateISO": "2026-02-14T18:00:00",
      "dayOfWeek": "sábado",
      "time": "18:00",
      "category": "polos",
      "types": [
        "indicamos",
        "tradicional"
      ],
      "city": "recife",
      "location": "Marco Zero",
      "isFree": true,
      "url": "https://penocarnaval.com.br/programacao/polo-marco-zero-sabado/"
    },
    {
      "id": "burra-do-rosario",
      "name": "Burra do Rosário",
      "date": "14/02/2026",
      "dateISO": "2026-02-14T18:00:00",
      "dayOfWeek": "sábado",
      "time": "18:00",
      "category": "blocos",
      "types": [],
      "city": "olinda",
      "location": "Sede da Burra - Guadalupe",
      "isFree": true,
      "url": "https://penocarnaval.com.br/programacao/burra-do-rosario/"
    },
    {
      "id": "afoxe-alafin-oyo",
      "name": "Afoxé Alafin Oyó",
      "date": "14/02/2026",
      "dateISO": "2026-02-14T18:00:00",
      "dayOfWeek": "sábado",
      "time": "18:00",
      "category": "blocos",
      "types": [],
      "city": "olinda",
      "location": "Largo do Guadalupe",
      "isFree": true,
      "url": "https://penocarnaval.com.br/programacao/afoxe-alafin-oyo/"
    },
    {
      "id": "patio-de-sao-pedro-sabado",
      "name": "Pátio de São Pedro",
      "date": "14/02/2026",
      "dateISO": "2026-02-14T18:00:00",
      "dayOfWeek": "sábado",
      "time": "18:00",
      "category": "polos",
      "types": [
        "indicamos",
        "tradicional",
        "fantasia"
      ],
      "city": "recife",
      "location": "Pátio de São Pedro",
      "isFree": true,
      "url": "https://penocarnaval.com.br/programacao/patio-de-sao-pedro-sabado/"
    },
    {
      "id": "polo-novo-cais-sabado",
      "name": "Novo Cais",
      "date": "14/02/2026",
      "dateISO": "2026-02-14T18:00:00",
      "dayOfWeek": "sábado",
      "time": "18:00",
      "category": "polos",
      "types": [],
      "city": "recife",
      "location": "Armazém do Campo",
      "isFree": true,
      "url": "https://penocarnaval.com.br/programacao/polo-novo-cais-sabado/"
    },
    {
      "id": "polo-gracas-sabado",
      "name": "Polo Graças",
      "date": "14/02/2026",
      "dateISO": "2026-02-14T18:00:00",
      "dayOfWeek": "sábado",
      "time": "18:00",
      "category": "polos",
      "types": [],
      "city": "recife",
      "location": "",
      "isFree": true,
      "url": "https://penocarnaval.com.br/programacao/polo-gracas-sabado/"
    },
    {
      "id": "polo-do-samba-sabado",
      "name": "Polo do Samba",
      "date": "14/02/2026",
      "dateISO": "2026-02-14T18:00:00",
      "dayOfWeek": "sábado",
      "time": "18:00",
      "category": "polos",
      "types": [],
      "city": "recife",
      "location": "",
      "isFree": true,
      "url": "https://penocarnaval.com.br/programacao/polo-do-samba-sabado/"
    },
    {
      "id": "john-travolta",
      "name": "John Travolta",
      "date": "14/02/2026",
      "dateISO": "2026-02-14T19:00:00",
      "dayOfWeek": "sábado",
      "time": "19:00",
      "category": "blocos",
      "types": [
        "indicamos",
        "tradicional"
      ],
      "city": "olinda",
      "location": "Clube Vassourinhas de Olinda",
      "isFree": true,
      "url": "https://penocarnaval.com.br/programacao/john-travolta/"
    },
    {
      "id": "polo-erasto-vasconcelos-sabado",
      "name": "Erasto Vasconcelos",
      "date": "14/02/2026",
      "dateISO": "2026-02-14T19:00:00",
      "dayOfWeek": "sábado",
      "time": "19:00",
      "category": "polos",
      "types": [
        "indicamos",
        "tradicional"
      ],
      "city": "olinda",
      "location": "Polo Erasto Vasconcelos",
      "isFree": true,
      "url": "https://penocarnaval.com.br/programacao/polo-erasto-vasconcelos-sabado/"
    },
    {
      "id": "rec-beat-sabado",
      "name": "Rec-Beat",
      "date": "14/02/2026",
      "dateISO": "2026-02-14T19:00:00",
      "dayOfWeek": "sábado",
      "time": "19:00",
      "category": "polos",
      "types": [
        "indicamos"
      ],
      "city": "recife",
      "location": "Cais da Alfândega",
      "isFree": true,
      "url": "https://penocarnaval.com.br/programacao/rec-beat-sabado/"
    },
    {
      "id": "seu-boteco-no-recife-antigo-sabado",
      "name": "SEU BOTECO NO RECIFE ANTIGO",
      "date": "14/02/2026",
      "dateISO": "2026-02-14T20:00:00",
      "dayOfWeek": "sábado",
      "time": "20:00",
      "category": "camarotes",
      "types": [],
      "city": "recife",
      "location": "Restaurante Seu Boteco",
      "isFree": false,
      "url": "https://penocarnaval.com.br/programacao/seu-boteco-no-recife-antigo-sabado/"
    },
    {
      "id": "homem-da-meia-noite",
      "name": "Homem da Meia Noite",
      "date": "14/02/2026",
      "dateISO": "2026-02-14T23:59:00",
      "dayOfWeek": "sábado",
      "time": "23:59",
      "category": "blocos",
      "types": [
        "indicamos",
        "tradicional"
      ],
      "city": "olinda",
      "location": "Sede do Homem da Meia Noite",
      "isFree": true,
      "url": "https://penocarnaval.com.br/programacao/homem-da-meia-noite/"
    },
    {
      "id": "cariri-olidense",
      "name": "Cariri Olidense",
      "date": "15/02/2026",
      "dateISO": "2026-02-15T04:00:00",
      "dayOfWeek": "domingo",
      "time": "04:00",
      "category": "blocos",
      "types": [
        "indicamos",
        "tradicional"
      ],
      "city": "olinda",
      "location": "Sede do Cariri",
      "isFree": true,
      "url": "https://penocarnaval.com.br/programacao/cariri-olidense/"
    },
    {
      "id": "as-filhas-de-betha",
      "name": "As Filhas de Betha",
      "date": "15/02/2026",
      "dateISO": "2026-02-15T08:00:00",
      "dayOfWeek": "domingo",
      "time": "08:00",
      "category": "blocos",
      "types": [],
      "city": "olinda",
      "location": "Largo do Amparo",
      "isFree": true,
      "url": "https://penocarnaval.com.br/programacao/as-filhas-de-betha/"
    },
    {
      "id": "patusco",
      "name": "Patusco",
      "date": "15/02/2026",
      "dateISO": "2026-02-15T08:59:00",
      "dayOfWeek": "domingo",
      "time": "08:59",
      "category": "blocos",
      "types": [
        "indicamos",
        "tradicional"
      ],
      "city": "olinda",
      "location": "Casa do Patusco",
      "isFree": true,
      "url": "https://penocarnaval.com.br/programacao/patusco/"
    },
    {
      "id": "casa-pe-no-carnaval-domingo",
      "name": "Casa PE no Carnaval",
      "date": "15/02/2026",
      "dateISO": "2026-02-15T09:00:00",
      "dayOfWeek": "domingo",
      "time": "09:00",
      "category": "day-use",
      "types": [
        "indicamos"
      ],
      "city": "olinda",
      "location": "Rua São Bento, 200",
      "isFree": false,
      "url": "https://penocarnaval.com.br/programacao/casa-pe-no-carnaval-domingo/"
    },
    {
      "id": "dbreck-domingo",
      "name": "D’BRECK",
      "date": "15/02/2026",
      "dateISO": "2026-02-15T09:00:00",
      "dayOfWeek": "domingo",
      "time": "09:00",
      "category": "blocos",
      "types": [
        "indicamos",
        "tradicional"
      ],
      "city": "olinda",
      "location": "Largo do Bonfim",
      "isFree": true,
      "url": "https://penocarnaval.com.br/programacao/dbreck-domingo/"
    },
    {
      "id": "mucha-lucha-2",
      "name": "Mucha Lucha",
      "date": "15/02/2026",
      "dateISO": "2026-02-15T09:00:00",
      "dayOfWeek": "domingo",
      "time": "09:00",
      "category": "blocos",
      "types": [
        "indicamos",
        "infantil"
      ],
      "city": "olinda",
      "location": "Alto da Sé",
      "isFree": true,
      "url": "https://penocarnaval.com.br/programacao/mucha-lucha-2/"
    },
    {
      "id": "batadoni",
      "name": "Batadoni",
      "date": "15/02/2026",
      "dateISO": "2026-02-15T09:00:00",
      "dayOfWeek": "domingo",
      "time": "09:00",
      "category": "blocos",
      "types": [],
      "city": "olinda",
      "location": "Praça do Carmo",
      "isFree": true,
      "url": "https://penocarnaval.com.br/programacao/batadoni/"
    },
    {
      "id": "batuques-de-pernambuco-cortejo-previa",
      "name": "Batuques de Pernambuco – Cortejo",
      "date": "15/02/2026",
      "dateISO": "2026-02-15T09:00:00",
      "dayOfWeek": "domingo",
      "time": "09:00",
      "category": "blocos",
      "types": [],
      "city": "olinda",
      "location": "Praça do Carmo",
      "isFree": true,
      "url": "https://penocarnaval.com.br/programacao/batuques-de-pernambuco-cortejo-previa/"
    },
    {
      "id": "rebylleurias",
      "name": "Rebylleurias",
      "date": "15/02/2026",
      "dateISO": "2026-02-15T09:30:00",
      "dayOfWeek": "domingo",
      "time": "09:30",
      "category": "blocos",
      "types": [],
      "city": "olinda",
      "location": "Rua do Bonfim, 449",
      "isFree": true,
      "url": "https://penocarnaval.com.br/programacao/rebylleurias/"
    },
    {
      "id": "birita-de-olinda",
      "name": "Birita de Olinda",
      "date": "15/02/2026",
      "dateISO": "2026-02-15T09:30:00",
      "dayOfWeek": "domingo",
      "time": "09:30",
      "category": "blocos",
      "types": [],
      "city": "olinda",
      "location": "Rua do Amparo 110",
      "isFree": true,
      "url": "https://penocarnaval.com.br/programacao/birita-de-olinda/"
    },
    {
      "id": "9480",
      "name": "Enquanto Isso na Sala da Justiça",
      "date": "15/02/2026",
      "dateISO": "2026-02-15T10:00:00",
      "dayOfWeek": "domingo",
      "time": "10:00",
      "category": "blocos",
      "types": [
        "indicamos",
        "tradicional",
        "fantasia"
      ],
      "city": "olinda",
      "location": "Alto da Sé",
      "isFree": true,
      "url": "https://penocarnaval.com.br/programacao/9480/"
    },
    {
      "id": "mulher-na-vara",
      "name": "MULHER NA VARA",
      "date": "15/02/2026",
      "dateISO": "2026-02-15T10:00:00",
      "dayOfWeek": "domingo",
      "time": "10:00",
      "category": "blocos",
      "types": [
        "indicamos",
        "tradicional"
      ],
      "city": "olinda",
      "location": "Rua da Boa Hora - Varadouro",
      "isFree": true,
      "url": "https://penocarnaval.com.br/programacao/mulher-na-vara/"
    },
    {
      "id": "casa-babylon-de-olinda-domingo",
      "name": "Casa Babylon de Olinda",
      "date": "15/02/2026",
      "dateISO": "2026-02-15T10:00:00",
      "dayOfWeek": "domingo",
      "time": "10:00",
      "category": "day-use",
      "types": [],
      "city": "olinda",
      "location": "Rua 27 de Janeiro, 7, Carmo",
      "isFree": false,
      "url": "https://penocarnaval.com.br/programacao/casa-babylon-de-olinda-domingo/"
    },
    {
      "id": "arrastao-da-bateria-cabulosa-domingo",
      "name": "Arrastão da Bateria Cabulosa",
      "date": "15/02/2026",
      "dateISO": "2026-02-15T10:00:00",
      "dayOfWeek": "domingo",
      "time": "10:00",
      "category": "blocos",
      "types": [],
      "city": "olinda",
      "location": "Ladeira em frente a Prefeitura de Olinda",
      "isFree": true,
      "url": "https://penocarnaval.com.br/programacao/arrastao-da-bateria-cabulosa-domingo/"
    },
    {
      "id": "desfile-da-bateria-aue-domingo",
      "name": "Desfile da Bateria Auê",
      "date": "15/02/2026",
      "dateISO": "2026-02-15T10:00:00",
      "dayOfWeek": "domingo",
      "time": "10:00",
      "category": "blocos",
      "types": [],
      "city": "olinda",
      "location": "Praça do Carmo",
      "isFree": true,
      "url": "https://penocarnaval.com.br/programacao/desfile-da-bateria-aue-domingo/"
    },
    {
      "id": "sambadeiras-primeiro-desfile",
      "name": "Sambadeiras",
      "date": "15/02/2026",
      "dateISO": "2026-02-15T10:00:00",
      "dayOfWeek": "domingo",
      "time": "10:00",
      "category": "blocos",
      "types": [
        "indicamos"
      ],
      "city": "olinda",
      "location": "Ladeira da Misericórdia",
      "isFree": true,
      "url": "https://penocarnaval.com.br/programacao/sambadeiras-primeiro-desfile/"
    },
    {
      "id": "estacao-da-luz-domingo",
      "name": "Estação da Luz",
      "date": "15/02/2026",
      "dateISO": "2026-02-15T10:00:00",
      "dayOfWeek": "domingo",
      "time": "10:00",
      "category": "day-use",
      "types": [],
      "city": "olinda",
      "location": "Casa Estação da Luz",
      "isFree": false,
      "url": "https://penocarnaval.com.br/programacao/estacao-da-luz-domingo/"
    },
    {
      "id": "me-adota",
      "name": "Me Adota",
      "date": "15/02/2026",
      "dateISO": "2026-02-15T10:00:00",
      "dayOfWeek": "domingo",
      "time": "10:00",
      "category": "blocos",
      "types": [],
      "city": "olinda",
      "location": "Praça do Carmo",
      "isFree": true,
      "url": "https://penocarnaval.com.br/programacao/me-adota/"
    },
    {
      "id": "congobloco-domingo",
      "name": "Congobloco",
      "date": "15/02/2026",
      "dateISO": "2026-02-15T10:00:00",
      "dayOfWeek": "domingo",
      "time": "10:00",
      "category": "blocos",
      "types": [],
      "city": "olinda",
      "location": "Sede do Maracatu Nação Pernambuco",
      "isFree": true,
      "url": "https://penocarnaval.com.br/programacao/congobloco-domingo/"
    },
    {
      "id": "mulher-do-dia-2",
      "name": "Mulher do Dia",
      "date": "15/02/2026",
      "dateISO": "2026-02-15T10:00:00",
      "dayOfWeek": "domingo",
      "time": "10:00",
      "category": "blocos",
      "types": [],
      "city": "olinda",
      "location": "CASA PE no Carnaval",
      "isFree": true,
      "url": "https://penocarnaval.com.br/programacao/mulher-do-dia-2/"
    },
    {
      "id": "bloco-tira-lama",
      "name": "Bloco Tira Lama",
      "date": "15/02/2026",
      "dateISO": "2026-02-15T10:00:00",
      "dayOfWeek": "domingo",
      "time": "10:00",
      "category": "blocos",
      "types": [],
      "city": "olinda",
      "location": "Rua do bonfim",
      "isFree": true,
      "url": "https://penocarnaval.com.br/programacao/bloco-tira-lama/"
    },
    {
      "id": "bloco-dos-desenrolados",
      "name": "BLOCO DOS DESENROLADOS",
      "date": "15/02/2026",
      "dateISO": "2026-02-15T11:00:00",
      "dayOfWeek": "domingo",
      "time": "11:00",
      "category": "blocos",
      "types": [],
      "city": "olinda",
      "location": "Colégio São Bento de Olinda",
      "isFree": false,
      "url": "https://penocarnaval.com.br/programacao/bloco-dos-desenrolados/"
    },
    {
      "id": "dez-de-xarque-e-uma-latinha-2",
      "name": "Dez de Xarque e Uma Latinha",
      "date": "15/02/2026",
      "dateISO": "2026-02-15T11:00:00",
      "dayOfWeek": "domingo",
      "time": "11:00",
      "category": "blocos",
      "types": [],
      "city": "olinda",
      "location": "Largo do Amparo",
      "isFree": true,
      "url": "https://penocarnaval.com.br/programacao/dez-de-xarque-e-uma-latinha-2/"
    },
    {
      "id": "fudidos-porem-unidos",
      "name": "Fudidos Porém Unidos",
      "date": "15/02/2026",
      "dateISO": "2026-02-15T11:30:00",
      "dayOfWeek": "domingo",
      "time": "11:30",
      "category": "blocos",
      "types": [
        "tradicional"
      ],
      "city": "olinda",
      "location": "Largo do Bonfim",
      "isFree": true,
      "url": "https://penocarnaval.com.br/programacao/fudidos-porem-unidos/"
    },
    {
      "id": "eternamente-sport",
      "name": "Eternamente Sport",
      "date": "15/02/2026",
      "dateISO": "2026-02-15T12:00:00",
      "dayOfWeek": "domingo",
      "time": "12:00",
      "category": "blocos",
      "types": [],
      "city": "olinda",
      "location": "Em frente a sede do homem da meia noite",
      "isFree": true,
      "url": "https://penocarnaval.com.br/programacao/eternamente-sport/"
    },
    {
      "id": "umurama",
      "name": "Umurama",
      "date": "15/02/2026",
      "dateISO": "2026-02-15T12:30:00",
      "dayOfWeek": "domingo",
      "time": "12:30",
      "category": "blocos",
      "types": [],
      "city": "olinda",
      "location": "Rua epitácio pessoa sobrinho, 91",
      "isFree": true,
      "url": "https://penocarnaval.com.br/programacao/umurama/"
    },
    {
      "id": "so-no-virote",
      "name": "Só no Virote",
      "date": "15/02/2026",
      "dateISO": "2026-02-15T13:00:00",
      "dayOfWeek": "domingo",
      "time": "13:00",
      "category": "blocos",
      "types": [],
      "city": "recife",
      "location": "R. Amélia Xavier Sampaio, 20",
      "isFree": true,
      "url": "https://penocarnaval.com.br/programacao/so-no-virote/"
    },
    {
      "id": "carvalheira-na-ladeira-segunda",
      "name": "CARVALHEIRA NA LADEIRA",
      "date": "15/02/2026",
      "dateISO": "2026-02-15T14:00:00",
      "dayOfWeek": "domingo",
      "time": "14:00",
      "category": "camarotes",
      "types": [
        "indicamos"
      ],
      "city": "olinda",
      "location": "Parque Memorial Arcoverde",
      "isFree": false,
      "url": "https://penocarnaval.com.br/programacao/carvalheira-na-ladeira-segunda/"
    },
    {
      "id": "carnaval-boa-viagem-domingo",
      "name": "Carnaval Boa Viagem",
      "date": "15/02/2026",
      "dateISO": "2026-02-15T14:00:00",
      "dayOfWeek": "domingo",
      "time": "14:00",
      "category": "camarotes",
      "types": [],
      "city": "recife",
      "location": "Arena Boa Viagem",
      "isFree": false,
      "url": "https://penocarnaval.com.br/programacao/carnaval-boa-viagem-domingo/"
    },
    {
      "id": "marim-dos-caetes",
      "name": "Marim dos Caetés",
      "date": "15/02/2026",
      "dateISO": "2026-02-15T14:00:00",
      "dayOfWeek": "domingo",
      "time": "14:00",
      "category": "blocos",
      "types": [],
      "city": "olinda",
      "location": "Largo do Guadalupe",
      "isFree": true,
      "url": "https://penocarnaval.com.br/programacao/marim-dos-caetes/"
    },
    {
      "id": "umuarama",
      "name": "Umuarama",
      "date": "15/02/2026",
      "dateISO": "2026-02-15T14:00:00",
      "dayOfWeek": "domingo",
      "time": "14:00",
      "category": "blocos",
      "types": [],
      "city": "olinda",
      "location": "Rua Epitácio Pessoa Sobrinho, 91",
      "isFree": true,
      "url": "https://penocarnaval.com.br/programacao/umuarama/"
    },
    {
      "id": "a-troca",
      "name": "A Troça",
      "date": "15/02/2026",
      "dateISO": "2026-02-15T15:00:00",
      "dayOfWeek": "domingo",
      "time": "15:00",
      "category": "blocos",
      "types": [],
      "city": "olinda",
      "location": "Cruzeiro do Convento de São Francisco",
      "isFree": true,
      "url": "https://penocarnaval.com.br/programacao/a-troca/"
    },
    {
      "id": "bloco-do-cimento",
      "name": "Bloco do Cimento",
      "date": "15/02/2026",
      "dateISO": "2026-02-15T15:00:00",
      "dayOfWeek": "domingo",
      "time": "15:00",
      "category": "blocos",
      "types": [],
      "city": "olinda",
      "location": "Clube Vassourinhas de Olinda",
      "isFree": true,
      "url": "https://penocarnaval.com.br/programacao/bloco-do-cimento/"
    },
    {
      "id": "polo-parque-da-jaqueira-domingo",
      "name": "Parque da Jaqueira (infantil)",
      "date": "15/02/2026",
      "dateISO": "2026-02-15T15:00:00",
      "dayOfWeek": "domingo",
      "time": "15:00",
      "category": "polos",
      "types": [
        "infantil"
      ],
      "city": "recife",
      "location": "Parque da Jaqueira",
      "isFree": true,
      "url": "https://penocarnaval.com.br/programacao/polo-parque-da-jaqueira-domingo/"
    },
    {
      "id": "polo-parque-santana-domingo",
      "name": "Parque Santana (infantil)",
      "date": "15/02/2026",
      "dateISO": "2026-02-15T15:00:00",
      "dayOfWeek": "domingo",
      "time": "15:00",
      "category": "polos",
      "types": [
        "infantil"
      ],
      "city": "recife",
      "location": "Parque Santana",
      "isFree": true,
      "url": "https://penocarnaval.com.br/programacao/polo-parque-santana-domingo/"
    },
    {
      "id": "polo-parque-macaxeira-infantil-domingo",
      "name": "Parque Macaxeira (infantil)",
      "date": "15/02/2026",
      "dateISO": "2026-02-15T15:00:00",
      "dayOfWeek": "domingo",
      "time": "15:00",
      "category": "polos",
      "types": [
        "infantil"
      ],
      "city": "recife",
      "location": "Parque Macaxeira",
      "isFree": true,
      "url": "https://penocarnaval.com.br/programacao/polo-parque-macaxeira-infantil-domingo/"
    },
    {
      "id": "polo-dona-lindu-infantil-domingo",
      "name": "Dona Lindu (infantil)",
      "date": "15/02/2026",
      "dateISO": "2026-02-15T15:00:00",
      "dayOfWeek": "domingo",
      "time": "15:00",
      "category": "polos",
      "types": [
        "infantil"
      ],
      "city": "recife",
      "location": "Parque Dona Lindu",
      "isFree": true,
      "url": "https://penocarnaval.com.br/programacao/polo-dona-lindu-infantil-domingo/"
    },
    {
      "id": "polo-aurora-infantil-domingo",
      "name": "Polo Aurora (infantil)",
      "date": "15/02/2026",
      "dateISO": "2026-02-15T15:00:00",
      "dayOfWeek": "domingo",
      "time": "15:00",
      "category": "polos",
      "types": [
        "infantil"
      ],
      "city": "recife",
      "location": "Rua da Aurora",
      "isFree": true,
      "url": "https://penocarnaval.com.br/programacao/polo-aurora-infantil-domingo/"
    },
    {
      "id": "a-cama-de-olinda",
      "name": "A cama de Olinda",
      "date": "15/02/2026",
      "dateISO": "2026-02-15T15:00:00",
      "dayOfWeek": "domingo",
      "time": "15:00",
      "category": "blocos",
      "types": [],
      "city": "olinda",
      "location": "Rua Coronel Joaquim Cavalcante",
      "isFree": true,
      "url": "https://penocarnaval.com.br/programacao/a-cama-de-olinda/"
    },
    {
      "id": "fogo-na-bacurinha",
      "name": "Fogo na bacurinha",
      "date": "15/02/2026",
      "dateISO": "2026-02-15T15:00:00",
      "dayOfWeek": "domingo",
      "time": "15:00",
      "category": "blocos",
      "types": [],
      "city": "olinda",
      "location": "Mercado da Ribeira",
      "isFree": true,
      "url": "https://penocarnaval.com.br/programacao/fogo-na-bacurinha/"
    },
    {
      "id": "grheia",
      "name": "Grheia",
      "date": "15/02/2026",
      "dateISO": "2026-02-15T15:30:00",
      "dayOfWeek": "domingo",
      "time": "15:30",
      "category": "blocos",
      "types": [],
      "city": "olinda",
      "location": "Alto da Sé",
      "isFree": true,
      "url": "https://penocarnaval.com.br/programacao/grheia/"
    },
    {
      "id": "unidos-pela-anseidade",
      "name": "Unidos pela Anseidade",
      "date": "15/02/2026",
      "dateISO": "2026-02-15T16:00:00",
      "dayOfWeek": "domingo",
      "time": "16:00",
      "category": "blocos",
      "types": [],
      "city": "olinda",
      "location": "Rua do Bonfim",
      "isFree": true,
      "url": "https://penocarnaval.com.br/programacao/unidos-pela-anseidade/"
    },
    {
      "id": "o-dono-do-mundo",
      "name": "O dono do mundo",
      "date": "15/02/2026",
      "dateISO": "2026-02-15T16:30:00",
      "dayOfWeek": "domingo",
      "time": "16:30",
      "category": "blocos",
      "types": [],
      "city": "olinda",
      "location": "Pátio do Bonsucesso",
      "isFree": true,
      "url": "https://penocarnaval.com.br/programacao/o-dono-do-mundo/"
    },
    {
      "id": "praca-do-arsenal-domingo",
      "name": "Praça do Arsenal",
      "date": "15/02/2026",
      "dateISO": "2026-02-15T17:00:00",
      "dayOfWeek": "domingo",
      "time": "17:00",
      "category": "polos",
      "types": [
        "indicamos",
        "tradicional",
        "fantasia"
      ],
      "city": "recife",
      "location": "Praça do Arsenal",
      "isFree": true,
      "url": "https://penocarnaval.com.br/programacao/praca-do-arsenal-domingo/"
    },
    {
      "id": "qg-do-frevo-domingo",
      "name": "QG do Frevo",
      "date": "15/02/2026",
      "dateISO": "2026-02-15T17:00:00",
      "dayOfWeek": "domingo",
      "time": "17:00",
      "category": "polos",
      "types": [
        "indicamos",
        "tradicional"
      ],
      "city": "recife",
      "location": "Praça da Independência",
      "isFree": true,
      "url": "https://penocarnaval.com.br/programacao/qg-do-frevo-domingo/"
    },
    {
      "id": "polo-guadalupe-domingo",
      "name": "Guadalupe",
      "date": "15/02/2026",
      "dateISO": "2026-02-15T17:00:00",
      "dayOfWeek": "domingo",
      "time": "17:00",
      "category": "polos",
      "types": [
        "indicamos",
        "tradicional"
      ],
      "city": "olinda",
      "location": "Guadalupe",
      "isFree": true,
      "url": "https://penocarnaval.com.br/programacao/polo-guadalupe-domingo/"
    },
    {
      "id": "parque-da-tamarineira-infantil",
      "name": "Parque da Tamarineira (infantil)",
      "date": "15/02/2026",
      "dateISO": "2026-02-15T17:00:00",
      "dayOfWeek": "domingo",
      "time": "17:00",
      "category": "polos",
      "types": [],
      "city": "recife",
      "location": "",
      "isFree": true,
      "url": "https://penocarnaval.com.br/programacao/parque-da-tamarineira-infantil/"
    },
    {
      "id": "eduardo-campos",
      "name": "Eduardo Campos",
      "date": "15/02/2026",
      "dateISO": "2026-02-15T17:00:00",
      "dayOfWeek": "domingo",
      "time": "17:00",
      "category": "polos",
      "types": [],
      "city": "recife",
      "location": "",
      "isFree": true,
      "url": "https://penocarnaval.com.br/programacao/eduardo-campos/"
    },
    {
      "id": "polo-marco-zero-domingo",
      "name": "MARCO ZERO",
      "date": "15/02/2026",
      "dateISO": "2026-02-15T18:00:00",
      "dayOfWeek": "domingo",
      "time": "18:00",
      "category": "polos",
      "types": [
        "indicamos",
        "tradicional"
      ],
      "city": "recife",
      "location": "Marco Zero",
      "isFree": true,
      "url": "https://penocarnaval.com.br/programacao/polo-marco-zero-domingo/"
    },
    {
      "id": "patio-de-sao-pedro-domingo",
      "name": "Pátio de São Pedro",
      "date": "15/02/2026",
      "dateISO": "2026-02-15T18:00:00",
      "dayOfWeek": "domingo",
      "time": "18:00",
      "category": "polos",
      "types": [
        "indicamos",
        "tradicional",
        "fantasia"
      ],
      "city": "recife",
      "location": "Pátio de São Pedro",
      "isFree": true,
      "url": "https://penocarnaval.com.br/programacao/patio-de-sao-pedro-domingo/"
    },
    {
      "id": "polo-gracas-domingo",
      "name": "Polo Graças",
      "date": "15/02/2026",
      "dateISO": "2026-02-15T18:00:00",
      "dayOfWeek": "domingo",
      "time": "18:00",
      "category": "polos",
      "types": [],
      "city": "recife",
      "location": "",
      "isFree": true,
      "url": "https://penocarnaval.com.br/programacao/polo-gracas-domingo/"
    },
    {
      "id": "polo-do-samba-domingo",
      "name": "Polo do Samba",
      "date": "15/02/2026",
      "dateISO": "2026-02-15T18:00:00",
      "dayOfWeek": "domingo",
      "time": "18:00",
      "category": "polos",
      "types": [],
      "city": "recife",
      "location": "",
      "isFree": true,
      "url": "https://penocarnaval.com.br/programacao/polo-do-samba-domingo/"
    },
    {
      "id": "9511",
      "name": "Elefante de Olinda",
      "date": "15/02/2026",
      "dateISO": "2026-02-15T19:00:00",
      "dayOfWeek": "domingo",
      "time": "19:00",
      "category": "blocos",
      "types": [
        "indicamos",
        "tradicional"
      ],
      "city": "olinda",
      "location": "Largo do Guadalupe",
      "isFree": true,
      "url": "https://penocarnaval.com.br/programacao/9511/"
    },
    {
      "id": "polo-erasto-vasconcelos-domingo",
      "name": "Erasto Vasconcelos",
      "date": "15/02/2026",
      "dateISO": "2026-02-15T19:00:00",
      "dayOfWeek": "domingo",
      "time": "19:00",
      "category": "polos",
      "types": [
        "indicamos",
        "tradicional"
      ],
      "city": "olinda",
      "location": "Polo Erasto Vasconcelos",
      "isFree": true,
      "url": "https://penocarnaval.com.br/programacao/polo-erasto-vasconcelos-domingo/"
    },
    {
      "id": "rec-beat-domingo",
      "name": "Rec-Beat",
      "date": "15/02/2026",
      "dateISO": "2026-02-15T19:00:00",
      "dayOfWeek": "domingo",
      "time": "19:00",
      "category": "polos",
      "types": [
        "indicamos"
      ],
      "city": "recife",
      "location": "Cais da Alfândega",
      "isFree": true,
      "url": "https://penocarnaval.com.br/programacao/rec-beat-domingo/"
    },
    {
      "id": "seu-boteco-no-recife-antigo-domingo",
      "name": "SEU BOTECO NO RECIFE ANTIGO",
      "date": "15/02/2026",
      "dateISO": "2026-02-15T20:00:00",
      "dayOfWeek": "domingo",
      "time": "20:00",
      "category": "camarotes",
      "types": [],
      "city": "recife",
      "location": "Restaurante Seu Boteco",
      "isFree": false,
      "url": "https://penocarnaval.com.br/programacao/seu-boteco-no-recife-antigo-domingo/"
    },
    {
      "id": "eu-acho-e-pouquinho",
      "name": "Eu acho é Pouquinho",
      "date": "16/02/2026",
      "dateISO": "2026-02-16T08:00:00",
      "dayOfWeek": "segunda-feira",
      "time": "08:00",
      "category": "blocos",
      "types": [
        "infantil"
      ],
      "city": "olinda",
      "location": "Rua de São Bento, 352",
      "isFree": true,
      "url": "https://penocarnaval.com.br/programacao/eu-acho-e-pouquinho/"
    },
    {
      "id": "casa-pe-no-carnaval-segunda",
      "name": "Casa PE no Carnaval",
      "date": "16/02/2026",
      "dateISO": "2026-02-16T09:00:00",
      "dayOfWeek": "segunda-feira",
      "time": "09:00",
      "category": "day-use",
      "types": [
        "indicamos"
      ],
      "city": "olinda",
      "location": "Rua São Bento, 200",
      "isFree": false,
      "url": "https://penocarnaval.com.br/programacao/casa-pe-no-carnaval-segunda/"
    },
    {
      "id": "tambores-dsaia-segunda",
      "name": "Tambores D’Saia",
      "date": "16/02/2026",
      "dateISO": "2026-02-16T09:00:00",
      "dayOfWeek": "segunda-feira",
      "time": "09:00",
      "category": "blocos",
      "types": [],
      "city": "olinda",
      "location": "Praça do Carmo",
      "isFree": true,
      "url": "https://penocarnaval.com.br/programacao/tambores-dsaia-segunda/"
    },
    {
      "id": "comigo-e-assim",
      "name": "Comigo é Assim",
      "date": "16/02/2026",
      "dateISO": "2026-02-16T09:00:00",
      "dayOfWeek": "segunda-feira",
      "time": "09:00",
      "category": "blocos",
      "types": [],
      "city": "olinda",
      "location": "Alto da Sé",
      "isFree": true,
      "url": "https://penocarnaval.com.br/programacao/comigo-e-assim/"
    },
    {
      "id": "soul-delas-segunda",
      "name": "Soul Delas",
      "date": "16/02/2026",
      "dateISO": "2026-02-16T09:00:00",
      "dayOfWeek": "segunda-feira",
      "time": "09:00",
      "category": "blocos",
      "types": [],
      "city": "olinda",
      "location": "Mosteiro de São Bento",
      "isFree": true,
      "url": "https://penocarnaval.com.br/programacao/soul-delas-segunda/"
    },
    {
      "id": "minha-cobra",
      "name": "Minha Cobra",
      "date": "16/02/2026",
      "dateISO": "2026-02-16T09:13:00",
      "dayOfWeek": "segunda-feira",
      "time": "09:13",
      "category": "blocos",
      "types": [],
      "city": "olinda",
      "location": "Em frente a sede do Homem da Meia Noite",
      "isFree": true,
      "url": "https://penocarnaval.com.br/programacao/minha-cobra/"
    },
    {
      "id": "10363",
      "name": "TCM Bloco MexicoPeru",
      "date": "16/02/2026",
      "dateISO": "2026-02-16T09:30:00",
      "dayOfWeek": "segunda-feira",
      "time": "09:30",
      "category": "blocos",
      "types": [],
      "city": "olinda",
      "location": "Ladeira da misericórdia",
      "isFree": true,
      "url": "https://penocarnaval.com.br/programacao/10363/"
    },
    {
      "id": "pitombeira-dos-quatro-cantos",
      "name": "Pitombeira dos Quatro Cantos",
      "date": "16/02/2026",
      "dateISO": "2026-02-16T10:00:00",
      "dayOfWeek": "segunda-feira",
      "time": "10:00",
      "category": "blocos",
      "types": [
        "indicamos",
        "tradicional"
      ],
      "city": "olinda",
      "location": "Sede da Pitombeira dos Quatro Cantos",
      "isFree": true,
      "url": "https://penocarnaval.com.br/programacao/pitombeira-dos-quatro-cantos/"
    },
    {
      "id": "casa-babylon-de-olinda-segunda",
      "name": "Casa Babylon de Olinda",
      "date": "16/02/2026",
      "dateISO": "2026-02-16T10:00:00",
      "dayOfWeek": "segunda-feira",
      "time": "10:00",
      "category": "day-use",
      "types": [],
      "city": "olinda",
      "location": "Rua 27 de Janeiro, 7, Carmo",
      "isFree": false,
      "url": "https://penocarnaval.com.br/programacao/casa-babylon-de-olinda-segunda/"
    },
    {
      "id": "bloco-segura-o-ovo",
      "name": "Bloco Segura o Ovo",
      "date": "16/02/2026",
      "dateISO": "2026-02-16T10:00:00",
      "dayOfWeek": "segunda-feira",
      "time": "10:00",
      "category": "blocos",
      "types": [],
      "city": "pernambuco",
      "location": "Amarilis Recepção - Bezerros/PE",
      "isFree": false,
      "url": "https://penocarnaval.com.br/programacao/bloco-segura-o-ovo/"
    },
    {
      "id": "estacao-da-luz-segunda",
      "name": "Estação da Luz",
      "date": "16/02/2026",
      "dateISO": "2026-02-16T10:00:00",
      "dayOfWeek": "segunda-feira",
      "time": "10:00",
      "category": "day-use",
      "types": [],
      "city": "olinda",
      "location": "Casa Estação da Luz",
      "isFree": false,
      "url": "https://penocarnaval.com.br/programacao/estacao-da-luz-segunda/"
    },
    {
      "id": "apoteose-dos-bonecos-gigantes",
      "name": "Apoteose dos Bonecos Gigantes",
      "date": "16/02/2026",
      "dateISO": "2026-02-16T10:00:00",
      "dayOfWeek": "segunda-feira",
      "time": "10:00",
      "category": "blocos",
      "types": [
        "indicamos",
        "tradicional"
      ],
      "city": "olinda",
      "location": "Alto da Sé",
      "isFree": true,
      "url": "https://penocarnaval.com.br/programacao/apoteose-dos-bonecos-gigantes/"
    },
    {
      "id": "se-eu-flopar-me-beija",
      "name": "Se Eu Flopar Me Beija",
      "date": "16/02/2026",
      "dateISO": "2026-02-16T10:00:00",
      "dayOfWeek": "segunda-feira",
      "time": "10:00",
      "category": "blocos",
      "types": [],
      "city": "olinda",
      "location": "Praça Cel João Lapa",
      "isFree": true,
      "url": "https://penocarnaval.com.br/programacao/se-eu-flopar-me-beija/"
    },
    {
      "id": "sombatuki",
      "name": "Sombatuki",
      "date": "16/02/2026",
      "dateISO": "2026-02-16T10:00:00",
      "dayOfWeek": "segunda-feira",
      "time": "10:00",
      "category": "blocos",
      "types": [],
      "city": "olinda",
      "location": "Largo do Bonfim",
      "isFree": true,
      "url": "https://penocarnaval.com.br/programacao/sombatuki/"
    },
    {
      "id": "minhocao-de-olinda",
      "name": "Minhocão de Olinda",
      "date": "16/02/2026",
      "dateISO": "2026-02-16T11:30:00",
      "dayOfWeek": "segunda-feira",
      "time": "11:30",
      "category": "blocos",
      "types": [
        "indicamos",
        "tradicional"
      ],
      "city": "olinda",
      "location": "Igreja de São Pedro",
      "isFree": true,
      "url": "https://penocarnaval.com.br/programacao/minhocao-de-olinda/"
    },
    {
      "id": "carvalheira-na-ladeira",
      "name": "CARVALHEIRA NA LADEIRA",
      "date": "16/02/2026",
      "dateISO": "2026-02-16T14:00:00",
      "dayOfWeek": "segunda-feira",
      "time": "14:00",
      "category": "camarotes",
      "types": [
        "indicamos"
      ],
      "city": "olinda",
      "location": "Parque Memorial Arcoverde",
      "isFree": false,
      "url": "https://penocarnaval.com.br/programacao/carvalheira-na-ladeira/"
    },
    {
      "id": "bloco-pre-sal",
      "name": "Bloco Pré-Sal",
      "date": "16/02/2026",
      "dateISO": "2026-02-16T14:00:00",
      "dayOfWeek": "segunda-feira",
      "time": "14:00",
      "category": "blocos",
      "types": [],
      "city": "olinda",
      "location": "Recanto do Pré-Sal",
      "isFree": true,
      "url": "https://penocarnaval.com.br/programacao/bloco-pre-sal/"
    },
    {
      "id": "carnaval-boa-viagem-segunda",
      "name": "Carnaval Boa Viagem",
      "date": "16/02/2026",
      "dateISO": "2026-02-16T14:00:00",
      "dayOfWeek": "segunda-feira",
      "time": "14:00",
      "category": "camarotes",
      "types": [
        "indicamos"
      ],
      "city": "recife",
      "location": "Arena Boa Viagem",
      "isFree": false,
      "url": "https://penocarnaval.com.br/programacao/carnaval-boa-viagem-segunda/"
    },
    {
      "id": "10548",
      "name": "Amantes de Glória",
      "date": "16/02/2026",
      "dateISO": "2026-02-16T14:00:00",
      "dayOfWeek": "segunda-feira",
      "time": "14:00",
      "category": "blocos",
      "types": [
        "tradicional"
      ],
      "city": "recife",
      "location": "Rua da Guia",
      "isFree": true,
      "url": "https://penocarnaval.com.br/programacao/10548/"
    },
    {
      "id": "vaca-profana",
      "name": "Vaca Profana",
      "date": "16/02/2026",
      "dateISO": "2026-02-16T14:00:00",
      "dayOfWeek": "segunda-feira",
      "time": "14:00",
      "category": "blocos",
      "types": [],
      "city": "olinda",
      "location": "Fortim do Queijo",
      "isFree": true,
      "url": "https://penocarnaval.com.br/programacao/vaca-profana/"
    },
    {
      "id": "metido-a-rico-porem-liso",
      "name": "METIDO A RICO PORÉM LISO",
      "date": "16/02/2026",
      "dateISO": "2026-02-16T14:00:00",
      "dayOfWeek": "segunda-feira",
      "time": "14:00",
      "category": "blocos",
      "types": [],
      "city": "olinda",
      "location": "Catedral da Seresta",
      "isFree": false,
      "url": "https://penocarnaval.com.br/programacao/metido-a-rico-porem-liso/"
    },
    {
      "id": "polo-parque-da-jaqueira-segunda",
      "name": "Parque da Jaqueira (infantil)",
      "date": "16/02/2026",
      "dateISO": "2026-02-16T15:00:00",
      "dayOfWeek": "segunda-feira",
      "time": "15:00",
      "category": "polos",
      "types": [
        "infantil"
      ],
      "city": "recife",
      "location": "Parque da Jaqueira",
      "isFree": true,
      "url": "https://penocarnaval.com.br/programacao/polo-parque-da-jaqueira-segunda/"
    },
    {
      "id": "polo-parque-santana-segunda",
      "name": "Parque Santana (infantil)",
      "date": "16/02/2026",
      "dateISO": "2026-02-16T15:00:00",
      "dayOfWeek": "segunda-feira",
      "time": "15:00",
      "category": "polos",
      "types": [
        "infantil"
      ],
      "city": "recife",
      "location": "Parque Santana",
      "isFree": true,
      "url": "https://penocarnaval.com.br/programacao/polo-parque-santana-segunda/"
    },
    {
      "id": "polo-parque-macaxeira-infantil-segunda",
      "name": "Parque Macaxeira (infantil)",
      "date": "16/02/2026",
      "dateISO": "2026-02-16T15:00:00",
      "dayOfWeek": "segunda-feira",
      "time": "15:00",
      "category": "polos",
      "types": [
        "infantil"
      ],
      "city": "recife",
      "location": "Parque Macaxeira",
      "isFree": true,
      "url": "https://penocarnaval.com.br/programacao/polo-parque-macaxeira-infantil-segunda/"
    },
    {
      "id": "polo-dona-lindu-infantil-segunda",
      "name": "Dona Lindu (infantil)",
      "date": "16/02/2026",
      "dateISO": "2026-02-16T15:00:00",
      "dayOfWeek": "segunda-feira",
      "time": "15:00",
      "category": "polos",
      "types": [
        "infantil"
      ],
      "city": "recife",
      "location": "Parque Dona Lindu",
      "isFree": true,
      "url": "https://penocarnaval.com.br/programacao/polo-dona-lindu-infantil-segunda/"
    },
    {
      "id": "polo-aurora-infantil-segunda",
      "name": "Polo Aurora (infantil)",
      "date": "16/02/2026",
      "dateISO": "2026-02-16T15:00:00",
      "dayOfWeek": "segunda-feira",
      "time": "15:00",
      "category": "polos",
      "types": [
        "infantil"
      ],
      "city": "recife",
      "location": "Rua da Aurora",
      "isFree": true,
      "url": "https://penocarnaval.com.br/programacao/polo-aurora-infantil-segunda/"
    },
    {
      "id": "grheia-segunda",
      "name": "Grheia",
      "date": "16/02/2026",
      "dateISO": "2026-02-16T15:30:00",
      "dayOfWeek": "segunda-feira",
      "time": "15:30",
      "category": "blocos",
      "types": [],
      "city": "olinda",
      "location": "Alto da Sé",
      "isFree": true,
      "url": "https://penocarnaval.com.br/programacao/grheia-segunda/"
    },
    {
      "id": "9477",
      "name": "Macuca – Cortejo oficial",
      "date": "16/02/2026",
      "dateISO": "2026-02-16T16:00:00",
      "dayOfWeek": "segunda-feira",
      "time": "16:00",
      "category": "blocos",
      "types": [
        "tradicional"
      ],
      "city": "olinda",
      "location": "Clube Vassourinhas",
      "isFree": true,
      "url": "https://penocarnaval.com.br/programacao/9477/"
    },
    {
      "id": "bloco-da-saudade-segunda",
      "name": "Bloco da Saudade",
      "date": "16/02/2026",
      "dateISO": "2026-02-16T16:00:00",
      "dayOfWeek": "segunda-feira",
      "time": "16:00",
      "category": "blocos",
      "types": [],
      "city": "recife",
      "location": "Praça Maciel Pinheiro",
      "isFree": true,
      "url": "https://penocarnaval.com.br/programacao/bloco-da-saudade-segunda/"
    },
    {
      "id": "o-charmoso",
      "name": "O Charmoso",
      "date": "16/02/2026",
      "dateISO": "2026-02-16T16:00:00",
      "dayOfWeek": "segunda-feira",
      "time": "16:00",
      "category": "blocos",
      "types": [],
      "city": "olinda",
      "location": "Bairro do monte",
